ItemID,Name,ServingSize,Calories,TotalFat,SaturatedFat,Cholesterol,Sodium,TotalCarbohydrate,DietaryFiber,Sugars,Protein,Calcium,Iron,IsVegetarian,Ingredients,Allergens
6debb5df-dd48-483a-9cf1-0bdd7377bf85,Pretzel Salad,4 x 8 Cut Serving,388.0751,14.9856,7.9449,10.1249,481.8079,61.3528,0.9959,33.515,3.1928,26.4609,0.7154,False,"Sliced Strawberries (Strawberries, Sugar.), Juice/water, Water (Water), Pretzel Rold Gold Twist Classic Tiny (Enriched Flour (Wheat Flour, Niacin, Reduced Iron, Thiamin Mononitrate, Riboflavin, Folic Acid), Salt, Corn Oil, Corn Syrup, Ammonium Bicarbonate, Malt Extract, And Yeast.), Strawberry Gelatin (Sugar, Dextrose, Gelatin, Less Than 2% Of Furmaric Acid, Disodium Phosphate, Sodium Citrate, Malic Acid, Natural and Artificial Flavor, Citric Acid, Red 40, Ascorbic Acid (Vitamin C), Red 40 Lake.), Whpd Topping, Cream Cheese (Pasteurized Milk And Cream, Whey Protein Concentrate, Whey, Salt, Carob Bean Gum, Xanthan Gum, Guar Gum, Natamycin A Natural Mold Inhibitor, Vitamin A Palmitate, Cheese Culture.), Granulated Sugar (Sugar.), Margarine (Vegetable Oil Blend (Palm Oil And Soybean Oil), Water, Salt, Contains Less Than 2% Of Soy Lecithin, Vegetable Mono Diglycerides, Potassium Sorbate (A Preservative), Citric Acid, Natural Artificial Flavor, Beta Carotene (Color), Vitamin A Palmitate Added, Whey.), Whipped Topping (Water, Hydrogenated Vegetable Oil (Palm, Palm Kernel, Coconut And/Or Cottonseed), High Fructose Corn Syrup, Contains Less Than 2% Of The Following: Carbohydrate Gum, Polysorbate 60, Salt, Polyglycerol Esters Of Fatty Acids, Soy Lecithin, Disodium Phosphate, Sodium Citrate, Xanthan Gum, Artificial Flavor, Natural Flavor, Colored With Turmeric And Annatto Extracts.), Water (Water), Granulated Sugar (Sugar.)","['Coconut', 'Gluten', 'Milk', 'Soy', 'Wheat']"
a7514d99-b7f4-4e13-88b0-18c2a1b2b47a,Toll House Pie with Pecans,10 Cut Serving,498.8004,32.5127,11.5726,33.9582,293.7055,49.6037,1.8446,33.0206,4.2201,23.0096,2.1592,True,"Pie Shell Raw 10"" (Enriched Flour (Wheat Flour, Niacin, Reduced Iron, Thiamine Mononitrate, Riboflavin, Folic Acid), Shortening (Interesterified Soybean Oil, Fully Hydrogenated Cottonseed Oil), Water, Contains 2% Or Less: White Grape Juice Concentrate, Salt, Citrus Fiber, Xanthan Gum.), Chocolate Chips Semisweet (Semi-Sweet Chocolate (Sugar, Chocolate, Cocoa Butter, Milk Fat, Soy Lecithin, Natural Flavor, Milk).), Margarine (Vegetable Oil Blend (Palm Oil And Soybean Oil), Water, Salt, Contains Less Than 2% Of Soy Lecithin, Vegetable Mono Diglycerides, Potassium Sorbate (A Preservative), Citric Acid, Natural Artificial Flavor, Beta Carotene (Color), Vitamin A Palmitate Added, Whey.), Brown Sugar (Sugar, Cane Molasses), Granulated Sugar (Sugar.), Pecan Pieces, Egg Whole Frozen (Egg (Whole Frozen)), Flour All Purpose H&R Gold Medal (Bleached Wheat Flour, Malted Barley Flour, Niacin, Iron, Thiamin Mononitrate, Riboflavin, Folic Acid.)","['Eggs', 'Gluten', 'Milk', 'Soy', 'Tree Nuts', 'Vegetarian', 'Wheat']"
f3ab0ee9-91cd-46ea-b9a2-f53be5b72e90,Sausage Tots,Ounce,102.8059,7.7883,2.1807,10.9036,221.1884,4.9845,0.3115,0g,2.4923,6.2307,0.3115,False,"Pork, Potato Shreds (Potatoes, Sodium Acid Pyrophosphate), Spices, Salt, Isolated Oat Product, Sodium Phosphate, Natural Flavors. Battered And Breaded With: Enriched Wheat Flour (Enriched With Niacin, Reduced Iron, Thiamine Mononitrate, Riboflavin, Folic Acid), Water, Dried Potatoes, Salt, Contains 2% Or Less Of: Dextrose, Sugar, Modified Food Starch, Potato Flour, Yeast, Wheat Gluten, Natural Flavors, Tapioca Starch, Sunflower Oil, Autolyzed Yeast Extract, Leavening (Cream Of Tartar, Sodium Bicarbonate), Dried Garlic, Dried Onion, Paprika And Turmeric Extracts. Breading Set In Vegetable Oil.","['Gluten', 'Wheat']"
c63604da-63c7-4ba1-9449-93f51a4ede6f,Beef & Broccoli Stir Fry,3/4 Cup,170.0638,8.7989,1.7056,22.6569,644.8092,11.2512,2.853,6.2971,12.1765,37.9738,1.4186,False,"Broccoli Florets (Broccoli.), Beef Strip 2"" x 1/2"" x 1/4"" (90% Or Better Extra Lean Cuts Of Beef), Matchstick Carrots, Sauce Oyster 6 x 5# (Water, Sugar, Salt, Oyster Extractives (Oyster, Water, Salt), Salt, Modified Corn Starch, Monosodium Glutamate, Wheat Flour, Caramel Color.), Canola Oil (Canola Oil With TBHQ And Citric Acid Added To Help Protect Flavor. Dimethylpolysiloxane, An Antifoaming Agent, Added.), Granulated Sugar (Sugar.), Garlic Chopped (Minced Garlic (Peeled Garlic)), Sauce Soy Mushroom 12 x 5# (Water, Soybeans, Sugar, Salt, Wheat Flour, Extract Of Mushroom, Sulfur Dioxide.)","['Gluten', 'Shellfish', 'Soy', 'Wheat']"
d8bcc6a7-eaf7-487f-9dc7-89f9bcb8e892,Grilled Pierogies,4 Each Serving,262.5213,7.1952,2.5114,9.9471,624.0222,41.7783,0.9948,0.9948,6.963,29.8415,2.1884,True,"Pierogi Cheddar Mrs. T's  1.34 oz (Water, Enriched Flour (Wheat Flour, Niacin, Iron, Thiamine Mononitrate, Riboflavin, Folic Acid), Potato Flakes (Potatoes, Mono And Diglycerides, Sodium Acid Pyrophosphate, Citric Acid), Soybean Oil, Dehydrated Cheddar Cheese (Cheddar Cheese [Pasteurized Milk, Cheese Cultures, Salt, Enzymes], Disodium Phosphate), Salt, Onion, Natural Flavor, Eggs, Yeast Extract, Whey, Spice, Annatto And Turmeric (Color).), Margarine (Vegetable Oil Blend (Palm Oil And Soybean Oil), Water, Salt, Contains Less Than 2% Of Soy Lecithin, Vegetable Mono Diglycerides, Potassium Sorbate (A Preservative), Citric Acid, Natural Artificial Flavor, Beta Carotene (Color), Vitamin A Palmitate Added, Whey.)","['Eggs', 'Gluten', 'Milk', 'Soy', 'Vegetarian', 'Wheat']"
9a3bb878-2fed-4e5f-b956-7774f0b28c05,Taco Shells,Shell,51.5625,2.4062,0.3437,0mg,0mg,6.875,0.6875,0g,0.6875,6.875,,True,"Whole Grain Corn, Water, Vegetable Oil (Cottonseed, Corn, And/Or Sunflower).","['Vegetarian', 'Vegan']"
2cc64a9e-d980-4f4c-a730-3e21d71435ba,Breaded Onion Rings,4 oz Serving,270.6089,12.8861,0g,0mg,502.5593,36.0812,1.2887,2.5772,3.8659,33.504,1.3917,True,"Onion Ring Battered Fried 4 x 2.5# (Onions, Enriched Wheat Flour (Flour, Niacin, Iron, Thiamine Mononitrate, Riboflavin, Folic Acid), Water, Corn Flour, Vegetable Oils (Canola, Soybean, Sunflower), Modified Cornstarch, Salt, Sugar, Leavening (Sodium Acid Pyrophosphate, Sodium Bicarbonate, Calcium Phosphate, Calcium Sulfate), Dextrose, Yeast, Spices, Guar Gum, Natural Flavor, Celery Seed.)","['Gluten', 'Soy', 'Vegetarian', 'Wheat']"
426a8fb8-2c00-4fa8-8bfa-9274b0b5f56b,Red Pepper Hummus Dip,Tablespoon,33.2221,2.8476,0g,0mg,47.4601,1.8984,1.4238,0g,0.4746,7.119,,True,"Chickpeas (Chickpeas, Water), Water, Olive Oil, Soybean Oil, Canola Oil, And/Or Sunflower Oil, Roasted Red Peppers, Sesame Tahini, Contains Less Than 2% Of Sea Salt, Citric Acid, Spices, Natural Roasted Garlic Flavor, Sodium Benzoate And Potassium Sorbate (To Preserve Freshness).","['Sesame', 'Soy', 'Vegetarian', 'Vegan']"
5c7d5c81-f792-4c46-8934-e3e09d731c6c,Grated Parmesan Cheese,Ounce,113.398,11.3398,5.6699,28.3495,396.893,0g,0g,0g,11.3398,442.2522,,True,"Grated Parmesan (Pasteurized Cow’s Milk, Salt, Enzymes), Powdered Cellulose Added To Prevent Caking.","['Milk', 'Vegetarian']"
582d0888-1a32-4013-8137-635f73c8efdb,Asian BBQ Stir Fry Sauce,Tablespoon,35.1495,0.0262,0.0011,0mg,214.5433,8.8101,0.036,7.6566,0.0149,0.9573,0.2384,True,"Ken's Cannonball BBQ Sauce (Sugar, Distilled Vinegar, Water, Tomato Paste, Molasses, Modified Potato Starch, Salt, Contains Less Than 2% Of Natural Smoke Flavor, Mustard Flour, Spice, Paprika, Onion, Garlic, Caramel Color, Maltodextrin, Chili Powder (Chili Pepper, Spice, Salt, Garlic), Autolyzed Yeast Extract, Natural Flavor.), Honey (Honey), Hoisin Sauce (Sugar, Water, Fermented Soybean Paste (Water, Salt, Soybeans, Wheat Flour), Salt, Modified Corn Starch, Contains Less Than 2% Of Sweet Potato Powder, Sesame Paste, Caramel Color, Spices, Dehydrated Garlic, Salted Chili Peppers (Chili Peppers, Salts), Acetic Acid, FD&C Red No. 40.), Spice Five Spice Powder 16 oz (Cinnamon, Star Anise, Cloves, Ginger, Sulfuring Agent)","['Gluten', 'Sesame', 'Soy', 'Vegetarian', 'Wheat']"
7fd8c8d0-602d-4fa5-be15-07dbfe33c5a7,MYO Breakfast Sandwich,,,,,,,,,,,,,False,,[]
d2cbf4e5-c35b-4e84-978e-a4d1a62f3377,Malt Vinegar,Teaspoon,0,0g,0g,0mg,0mg,0g,0g,0g,0g,,,True,"Malt Vinegar Barley, Corn Malt, Diluted With Water To 5 Acidity.","['Gluten', 'Vegetarian', 'Vegan']"
5864b483-1248-43f2-b7fb-9fd333053e41,Mountain Nut Cookie,Cookie,232.7444,11.6483,3.5451,9.2975,149.0206,31.4946,1.7772,20.1774,3.2225,19.0721,1.5087,True,"Chocolate Chips Semisweet (Semi-Sweet Chocolate (Sugar, Chocolate, Cocoa Butter, Milk Fat, Soy Lecithin, Natural Flavor, Milk).), Raisins (Raisins), Walnut Pieces, Granulated Sugar (Sugar.), Flour All Purpose H&R Gold Medal (Bleached Wheat Flour, Malted Barley Flour, Niacin, Iron, Thiamin Mononitrate, Riboflavin, Folic Acid.), Cereal Oats Quick (Whole Grain Rolled Oats.), Margarine (Vegetable Oil Blend (Palm Oil And Soybean Oil), Water, Salt, Contains Less Than 2% Of Soy Lecithin, Vegetable Mono Diglycerides, Potassium Sorbate (A Preservative), Citric Acid, Natural Artificial Flavor, Beta Carotene (Color), Vitamin A Palmitate Added, Whey.), Brown Sugar (Sugar, Cane Molasses), Egg Whole Frozen (Egg (Whole Frozen)), Baking Soda 24 x 1# (Sodium Bicarbonate), Iodized Salt (Salt, Sodium Silicoaluminate, Dextrose, Potassium Iodine)","['Eggs', 'Gluten', 'Milk', 'Soy', 'Tree Nuts', 'Vegetarian', 'Wheat']"
46576a88-05f8-4323-83ed-559ba4533f37,Crumbled Feta Cheese,Tablespoon,22.44,1.8088,1.2704,7.565,77.945,0.3476,0g,0.3476,1.2078,41.905,0.0552,True,"Feta Cheese (Pastruized Milk, Cheese Cultures, Salt, Enzymes), Powdered Cellulose To Prevent Caking, Natamycin To Protect Flavor","['Milk', 'Vegetarian']"
6a25c460-2a03-4434-a1cf-46fcaf801974,Pepperoni Pizza,12 Cut Serving,162.8257,7.2304,3.5585,17.7896,337.483,17.5881,0.5547,1.3235,6.2366,69.0935,1.0875,False,"Dough Pizza Sheeted 10"" (Enriched Flour (Wheat Flour, Malted Barley Flour, Niacin, Iron, Thiamine Mononitrate, Riboflavin, Folic Acid), Water, Soybean Oil, Yeast, Dry Malt (Malted Barley Flour, Wheat Flour, Dextrose), Salt, Sugar, Baking Powder (Corn Starch, Sodium Bicarbonate, Sodium Acid Pyrophosphate, Sodium Aluminum Phosphate), Dough Improver (Wheat Flour, Monocalcium Phosphate, Corn Starch, Salt, Mono- And- Diglycerides, Contains 2% Or Less Of: Ascorbic Acid, Potassium Iodate & Enzyme).), Cheese Blend Ford Pizza (Cheese New York Blend (Low-Moisture Whole Milk Mozzarella Cheese (Cultured Pasteurized Milk, Salt,
Enzymes), Low-Moisture Part-Skim Mozzarella Cheese (Cultured Pasteurized Part-Skim
Milk, Salt, Enzymes).), Cheese Asiago Shredded (Asiago Cheese (Pasteurized Milk, Cheese Cultures, Salt, Enzymes), Powdered Cellulose (To Prevent Caking).)), Diced Pepperoni (Pork And Beef, Salt, Contains 2% Or Less Of Water, Dextrose, Spices, Lactic Acid Starter Culture, Oleoresin Of Paprika,  Garlic Powder, Sodium Nitrite, BHA, BHT, Citric Acid.), Pizza Sauce (Vine Ripened Fresh Tomatoes, Blend of Extra Virgin Olive Oil And Sunflower Oil, Salt, Oregano, Granulated Garlic, Black Pepper, And Naturally Derived Citric Acid.), Flour All Purpose H&R Gold Medal (Bleached Wheat Flour, Malted Barley Flour, Niacin, Iron, Thiamin Mononitrate, Riboflavin, Folic Acid.), Flour Semolina Gold Medal 50# (Semolina (Wheat), Niacin, Ferrous Sulfate, Thiamine Mononitrate, Riboflavin, Folic Acid.)","['Gluten', 'Milk', 'Soy', 'Wheat']"
3b781347-4994-4d38-975d-aaff9adb3bca,Pineapple Cubes,1/2 Cup Serving,88.9891,0.1035,0.0072,0mg,2.0695,22.9716,1.1382,21.8334,0.4139,9.3128,0.4139,True,Pineapple,"['Vegetarian', 'Vegan']"
41ef7641-cf51-400b-8fb1-ca32c15dbfc2,Meatballs in Thai Sweet Chili Sauce,1 Each Serving,162.417,8.6531,3.5512,40.4993,474.2886,12.953,0.2181,7.5411,9.2535,30.9379,0.6619,False,"Meatball (Chicken Thigh Meat With Skin, Chicken Breast Meat With Rib Meat, Beef, Water, Bread Crumbs (Wheat Flour, Salt, And Yeast), Romano Cheese (Pasteurized Cow's Milk, Cheese Cultures, Salt, Enzymes), Ricotta Cheese (Whey, Part Skim Milk, Cream, Vinegar, And Xanthan Gum, Locust Bean Gum, Guar Gum [Stabilizers]), Liquid Egg Whites, Textured Vegetable Protein (Soy Protein Concentrate, Caramel Color), Contains 2% Or Less Of Salt, Dried Garlic, Spices, Parsley, Brown Sugar, Caramel Color, BHA, BHT, Disodium Inosinate And Disodium Guanylate, Citric Acid.), Sweet Chili Sauce (Water, Sugar, Red Wine Vinegar, Red Bell Peppers (Red Bell Peppers, Vinegar, Salt, Potassium Sorbate And Sodium Benzoate [Preservatives], Calcium Chloride), Jalapeno Peppers (Jalapeno Peppers, Water, Salt, Vinegar, Calcium Chloride, Potassium Sorbate [Preservative], Capsicum Oleoresin), Modified Cornstarch, 2% Or Less Of Spices, Garlic, Xanthan Gum, Salt.), Green Onion (Onion Green), Matchstick Carrots, Fresh Basil (Fresh Basil), Lemon Juice (Filtered Water, Lemon Juice Concentrate, Sodium Bisulfite (Preservative), Sodium Benzoate (Preservative), Lemon Oil), Crushed Red Pepper (Crushed Red Pepper)","['Eggs', 'Gluten', 'Milk', 'Soy', 'Wheat']"
590c517a-0afa-43bf-b72a-706b6a23a0ac,Delicious Fruit Salad,1/2 Cup,58.4013,0.278,0.0715,0.3335,10.4912,14.4331,1.3167,11.6538,0.9408,24.5261,0.239,True,"Fresh Pineapple (Pineapple), Vanilla Yogurt (Cultured Grade A Low Fat Milk, Sugar, Modified Corn Starch. Contains 1% Or Less Of: Corn Starch, Natural Flavor, Potassium Sorbate Added To Maintain Freshness, Vitamin A Acetate, Vitamin D3.), Red Seedless Grapes, Fresh Strawberries (Fresh Strawberries.), Melon Cantaloupe California 12 Ct (Cantaloupe), Fresh Blueberries (Blueberries.), Melon Honeydew 5 Ct. (Honeydew Melon), Fresh Red Raspberries (Raspberries.), Honey (Honey), Lemon Zest (Lemon (Lemons Fresh))","['Milk', 'Vegetarian']"
9b0ab17d-a4da-4306-8f33-5fceca7ba80e,Lime Gelatin,1/2 Cup Serving,104.4455,0g,0g,0mg,156.6683,25.3653,0g,25.3653,1.492,,,False,"Water (Water), Water (Water), Gelatin Lime (Sugar, Dextrose, Gelatin, Less Than 2% Of Fumaric Acid, Sodium Citrate, Disodium Phosphate, Malic Acid, Citric Acid, Natural Flavor, Ascorbic Acid (Vitamin C), Yellow 5, Yellow 5 Lake, Blue 1, Blue 1 Lake.)",[]
36a2e399-0026-4d2f-9bd4-d09966e0a83a,Stuffed Shells,1 Each Serving,162.5236,5.6223,2.6857,19.8193,495.2477,22.5328,2.6825,5.5671,7.2944,126.06,1.0823,True,"Sauce Spaghetti without Meat 6 x #10 (Tomato Puree (Water, Tomato Paste), High Fructose Corn Syrup, Contains Less Than 2% Of: Soybean Oil, Salt, Dried Onion, Citric Acid, Spices, Dried Garlic, Natural Flavor.), Pasta Shell Stuffed Cheese 1.75oz 10# (Ricotta Cheese (Pasteurized Milk, Pasteurized Whey, Pasteurized Cream, Vinegar, Salt), Enriched Semolina Flour (Semolina Flour [Niacin, Ferrous Sulfate, Thiamine Mononitrate, Riboflavin, Folic Acid]), Water, Romano Cheese (Pasteurized Cow’s And/Or Sheep’s Milk, Cheese Culture, Salt, Enzymes), Pasteurized Whole Eggs, Corn Starch, Sea Salt, Dietary Fiber, Parsley, Spices, Stabilizers (Xanthan Gum, Locust Bean Gum, Guar Gum), Turmeric (Color).), Shredded Cheese (Paseurized Milk, Cheese Cultures, Salt, Enzymes.)","['Eggs', 'Gluten', 'Milk', 'Soy', 'Vegetarian', 'Wheat']"
991aa015-3197-46d7-af1b-6413a030070c,Plain Bagel,Bagel,252.6595,1.5159,0.5053,0mg,495.2128,51.5425,2.0213,6.0638,9.0958,131.383,2.8298,True,"Enriched Flour (Wheat Flour, Malted Barley, Niacin, Reduced Iron, Thiamine Mononitrate, Riboflavin, Folic Acid), Water, Sugar, Yeast, Contains Less Than 2% Of Each Of The Following: Salt, Wheat Gluten, Calcium Propionate (A Preservative), Guar Gum, Soybean Oil, Wheat Flour, Sodium Stearoyl Lactylate, Monoglycerides, Citric Acid (A Preservative), Sorbic Acid (A Preservative), Enzymes, Hydrogenated Soybean Oil, Degerminated Yellow Corn Meal, Ascorbic Acid (A Preservative).","['Gluten', 'Soy', 'Vegetarian', 'Vegan', 'Wheat']"
35832be4-0406-4128-88c4-ef878983b7ad,Steak Roll Bun,Bun,250.0,3.0,1.0,0mg,530.0,50.0,2.0,2.0,8.0,52.0,0.72,True,"Flour (Wheat, Malted Barley), Water, Palm Oil, Sugar, Salt, Contains Less Than 2% Of Each Of The Following: Yeast, Guar Gum, Enriched Flour (Wheat, Niacin, Reduced Iron, Thiamine Mononitrate, Riboflavin, Felic Acid), Enzyme, Ascorbic Acid, Calcium Propionate (Preservative).","['Gluten', 'Vegetarian', 'Vegan', 'Wheat']"
4c4ddf01-e17b-41c4-a64f-2bf893851425,Meatless Cavatini,1/2 Cup,154.5604,4.9734,2.1108,10.9685,429.0759,23.1573,2.6513,6.5752,6.6743,119.2403,1.2797,True,"Water (Water), Sauce Spaghetti without Meat 6 x #10 (Tomato Puree (Water, Tomato Paste), High Fructose Corn Syrup, Contains Less Than 2% Of: Soybean Oil, Salt, Dried Onion, Citric Acid, Spices, Dried Garlic, Natural Flavor.), Rotini Pasta (Semolina Wheat, Durum Wheat Flour, Vitamin B3 Niacin, Iron Ferrous Sulfate, Vitamin B1 Thiamin Mononitrate, Vitamin B2 Riboflavin, Folic Acid), Shredded Cheese (Paseurized Milk, Cheese Cultures, Salt, Enzymes.), Shredded Cheese (Paseurized Milk, Cheese Cultures, Salt, Enzymes.), Yellow Onion, Green Pepper (Green Pepper), Mushroom Sliced (Mushrooms, Water, Salt, Citric Acid And/Or Ascorbic Acid.)","['Gluten', 'Milk', 'Soy', 'Vegetarian', 'Wheat']"
1cf43856-6395-425e-bc1a-7ada564d9627,Fruit Cocktail,1/2 Cup,47.2567,0g,0g,0mg,0mg,12.6018,0.7877,10.239,0g,,,True,"Fruit Cocktail (Diced Peaches, Water, Diced Pears, Grapes, Sugar, Pineapple Sectors, Halved Cherries (Artificially Colored Red With Carmine))","['Vegetarian', 'Vegan']"
91d863a5-ef1e-4d09-bb05-447a78b10cd4,Lemon Poppy Seed Muffin,Muffin,289.3172,8.7521,3.7477,3.6652,436.3275,50.2583,1.1134,26.6525,2.5391,46.1093,1.5581,True,"Muffin Mix Variety (Enriched Flour Bleached (Wheat Flour, Niacin, Iron, Thiamin Mononitrate, Riboflavin, Folic Acid), Sugar, Palm Oil, Modified Corn Starch, Modified Whey. Contains 2% Or Less Of: Leavening (Sodium Acid Pyrophosphate, Baking Soda, Monocalcium Phosphate), Dextrose, Mono And Diglycerides, Salt, Eggs With Sodium Silicoaluminate, Xanthan Gum, Nonfat Milk, Natural Flavor, Soy Flour.), Water (Water), Lemon Juice (Filtered Water, Lemon Juice Concentrate, Sodium Bisulfite (Preservative), Sodium Benzoate (Preservative), Lemon Oil), Spice Poppy Seed 20 oz, Food Color Liquid Egg Shade Yellow (Water, Propylene Glycol, Yellow 5, And Propylparaben (Preservative).)","['Eggs', 'Gluten', 'Milk', 'Soy', 'Vegetarian', 'Wheat']"
e7580022-f2c8-42c0-b31a-612bcf7a82de,Delicious Glazed Lemon Cake,8x10 Cut Serving,207.3463,3.153,1.5761,5.2499,252.7291,43.4658,0.5503,32.7163,1.5946,0.6071,0.5903,True,"Mix Cake Yellow (Sugar, Enriched Flour Bleached (Wheat Flour, Niacin, Iron, Thiamin Mononitrate, Riboflavin, Folic Acid), Palm Oil, Dextrose. Contains 2 % Or Less Of: Leavening (Sodium Aluminum Phosphate, Baking Soda), Propylene Glycol Mono And Diesters Of Fatty Acids, Modified Corn Starch, Egg With Sodium Silicoaluminate, Egg White, Salt, Nonfat Milk, Mono And Diglycerides, Modified Whey, Xanthan Gum, Natural Flavor, Annatto And Turmeric Extract Color, Defatted Soy Flour.), Water (Water), Powdered Sugar (Sugar, Carnauba Wax), Mix Pudding Instant Lemon 24 oz. (Sugar, Dextrose, Modified Corn Starch, Tetrasodium Pyrophosphate, Contains 2% Or Less Of Each Of The Following: Disodium Phosphate, Natural And Artificial Flavor, Monoglycerides, Soy Lecithin, Whey, Sodium Caseinate, Palm Oil, Yellow 5, Yellow 6.), Lemon Juice (Filtered Water, Lemon Juice Concentrate, Sodium Bisulfite (Preservative), Sodium Benzoate (Preservative), Lemon Oil), Lemon Juice (Filtered Water, Lemon Juice Concentrate, Sodium Bisulfite (Preservative), Sodium Benzoate (Preservative), Lemon Oil)","['Eggs', 'Gluten', 'Milk', 'Soy', 'Vegetarian', 'Wheat']"
17b18219-d93b-45a5-9eea-c5eb4ca157a9,Burning Tree Vegan Stew,1/2 Cup Serving,55.6313,1.6965,0.1269,0mg,472.7553,9.409,2.6779,3.3271,1.0456,25.0077,0.3282,True,"Hominy White Bush's 6 x #10 (White Corn, Water, Salt, And Sodium Bisulfite (Added To Promote Color Retention).), Water (Water), Tomato Diced 6 x #10 (Tomatoes, Tomato Juice, Less Than 2% Of: Salt, Calcium Chloride, Citric Acid.), Carrots Sliced Coin 20# (Carrots), Diced Onion, Canola Oil (Canola Oil With TBHQ And Citric Acid Added To Help Protect Flavor. Dimethylpolysiloxane, An Antifoaming Agent, Added.), Base Vegetable Mirepoix Sauteed 6 x 1# (Sauteed Vegetable Puree Mix (Carrots, Onions, Celery), Salt, Sugar, Maltodextrin, Corn Oil, Less Than 2% Of Yeast Extract, Water, Potato Starch, Xanthan Gum, Natural Flavors, Carrot Juice Concentrate.), Garlic Chopped (Minced Garlic (Peeled Garlic)), Granulated Sugar (Sugar.), Iodized Salt (Salt, Sodium Silicoaluminate, Dextrose, Potassium Iodine), Ground Cumin (Cumin), Spice Chili Powder Mild 18 oz (Chili Pepper And Other Spices, Salt, Garlic), Squash Butternut Diced 3/4"" 5#","['Vegetarian', 'Vegan']"
d4e67867-d2a1-405c-bf76-1fc9080632eb,Sport Pepper,Tablespoon,3.1324,0g,0g,0mg,250.0198,0g,0g,,0g,,,True,"Mississippi Sport Peppers, Water, Vinegar, Salt, Calcium Chloride, Sodium Benzoate (As A Preservative), Tumerica And A Trace Of Potassium Sorbate.","['Vegetarian', 'Vegan']"
912a08c4-1d05-40a3-9ba1-358e7573ef84,Chocolate Cream Pie,10 Cut Serving,308.6064,15.1087,14.8325,3.0482,304.4211,34.4034,0g,19.6485,1.326,85.3173,0.1757,True,"2% Milk, Whipped Topping (Water, Hydrogenated Vegetable Oil (Palm, Palm Kernel, Coconut And/Or Cottonseed), High Fructose Corn Syrup, Contains Less Than 2% Of The Following: Carbohydrate Gum, Polysorbate 60, Salt, Polyglycerol Esters Of Fatty Acids, Soy Lecithin, Disodium Phosphate, Sodium Citrate, Xanthan Gum, Artificial Flavor, Natural Flavor, Colored With Turmeric And Annatto Extracts.), Pie Shell Oreo 9"" (Unbleached Enriched Flour (Wheat Flour, Niacin, Reduced Iron, Thiamine Mononitrate (Vitamin B1), Riboflavin (Vitamin B2), Folic Acid), Sugar, Palm And/Or Canola Oil, Cocoa (Processed With Alkali), High Fructose Corn Syrup, Leavening (Baking Soda And/Or Calcium Phosphate), Salt, Soy Lecithin, Cornstarch, Chocolate, Artificial Flavor, TBHQ And Citric Acid Added To Preserve Freshness.), Mix Pudding Instant Chocolate 24 oz. (Dextrose, Sugar, Modified Food Starch, Cocoa Processed With Alkali, Less Than 2% Disodium Phosphate, Tetrasodium Pyrophosphate, Salt, Tricalcium Phosphate, Caramel Color, Natural And Artificial Flavor, Silicon Dioxide, Emulsifier Blend (Nonfat Dry Milk, Mono And Diglycerides), Red 40.), Whpd Topping, Whipped Topping (Water, Hydrogenated Vegetable Oil (Palm, Palm Kernel, Coconut And/Or Cottonseed), High Fructose Corn Syrup, Contains Less Than 2% Of The Following: Carbohydrate Gum, Polysorbate 60, Salt, Polyglycerol Esters Of Fatty Acids, Soy Lecithin, Disodium Phosphate, Sodium Citrate, Xanthan Gum, Artificial Flavor, Natural Flavor, Colored With Turmeric And Annatto Extracts.), Water (Water)","['Coconut', 'Gluten', 'Milk', 'Soy', 'Vegetarian', 'Wheat']"
55e312d4-80f1-4349-84f5-57d521347c56,Hamburger Bun,Bun,139.6476,1.4962,0g,0mg,229.4209,27.9295,0.9975,3.9899,3.9899,49.8741,1.995,True,"Enriched Flour (Unbleached Wheat Flour, Malted Barley Flour, Reduced Iron, Thiamine Mononitrate [Vitamin B1], Riboflavin [Vitamin B2], Niacin [Vitamin B3], Folic Acid), Water, High Fructose Corn Syrup, Yeast, Soybean Oil, Wheat Gluten, Salt, Calcium Propionate (A Preservative), Monoglycerides, Sodium Stearoyl Lactylate, Wheat Starch, Calcium Sulfate, Calcium Phosphate, Ascorbic Acid, Sesame.","['Gluten', 'Sesame', 'Soy', 'Vegetarian', 'Vegan', 'Wheat']"
3cfbde0e-1421-4a83-ba4b-a497a80a267f,Popcorn Chicken,6 oz Serving,391.2231,15.3087,2.5515,42.5242,1020.582,44.2252,3.4019,0g,18.7107,18.7107,1.701,False,"Popcorn Chicken (Chicken Breast Meat With Rib Meat, Water, Salt, Sodium Phosphates. Breaded With Wheat Flour, Bleached Wheat Flour, Salt, Palm Oil, Spices, Onion Powder, Leavening (Sodium Acid Pyrophosphate, Sodium Bicarbonate), Yeast Extract, Dried Yeast, Sugar, Paprika Extract (Color), Annatto Extract (Color). Breaded With Enriched Bleached Wheat Flour (Enriched With Niacin, Ferrous Sulfate, Thiamine Mononitrate, Riboflavin, Folic Acid), Salt, Spices, Soybean Oil, Garlic Powder, Leavening (Sodium Acid Pyrophosphate, Sodium Bicarbonate), Yellow Corn Flour, Extractives Of Paprika, Natural Flavor. Battered With Water, Enriched Bleached Wheat Flour (Enriched With Niacin, Ferrous Sulfate, Thiamine Mononitrate, Riboflavin, Folic Acid), Modified Food Starch, Yellow Corn Flour, Salt. Garlic Powder, Dextrose, Spices, Extractives Of Paprika, Cellulose Gum (Sodium Carboxymethylcellulose), Soybean Oil, Sodium Alginate, Natural Flavors. Predusted With Enriched Bleached Wheat And Durum Flours (Enriched With Naicin, Ferrous Sulfate, Thiamine Mononitrate, Riboflavin, Folic Acid), Garlic Powder, Soybean Oil, Spices, Salt, Yellow Corn Flour, Extractives Of Paprika, Natural Flavor.)","['Gluten', 'Soy', 'Wheat']"
91e71f82-109b-479b-aa53-ac4b74f11f52,Blackened Beef Burger,Burger,207.5744,16.2474,6.9287,49.3283,1441.1282,1.1975,0.5245,0.0917,14.4438,26.6794,2.0776,False,"Beef Patty 4/# 80/20 TNJ (Beef, Water, Spice, Salt.), Spice Cajun/Andouille Rub (Salt, Spices, Onion Powder, Garlic Powder, Extractives Of Spice And Paprika.)",[]
dce56ce2-a4d6-4411-be23-abecf03276e9,Vegan Breakfast Scramble,Serving,104.1375,1.0449,0.3612,0mg,540.1416,20.5512,7.5979,8.4916,7.3137,67.4772,1.8186,True,"Cauliflower Floret, Red Pepper (Red Pepper), Green Pepper (Green Pepper), Red Onion, Sliced Fresh Mushrooms (Raw Mushrooms.), Sauce Soy Tamari GF (Water, Soybeans, Salt, Alcohol (To Preserve Freshness).), Yeast Nutritional 10# (Inactive Yeast.), Garlic Chopped (Minced Garlic (Peeled Garlic)), Spice Ground Turmeric 1# (Ground Turmeric), Iodized Salt (Salt, Sodium Silicoaluminate, Dextrose, Potassium Iodine), Spice Pepper Black Ground 18 oz (Black Pepper), Cayenne Pepper (Red Pepper)","['Soy', 'Vegetarian', 'Vegan']"
a3dbeea0-ac0c-48ad-97b8-eed89ffa7bf8,Tostadas,24ct Pkg,2073.0572,115.1698,69.1019,0mg,2418.5667,230.3397,0g,0g,23.034,460.6794,6.9102,True,"Stone Ground Corn, Corn Oil Or Palm Olein Oil, Sea Salt, Calcium Hydroxide. May Contain One Or More Hydrated Chipotle Pepper, Arbol Pepper, Jalapeno Pepper, Citric Acid, Spices.","['Vegetarian', 'Vegan']"
