ItemID,Name,ServingSize,Calories,TotalFat,SaturatedFat,Cholesterol,Sodium,TotalCarbohydrate,DietaryFiber,Sugars,Protein,Calcium,Iron,IsVegetarian,Ingredients,Allergens
0fd38f5e-ebb5-48bd-bb93-8de6e431e07d,Coconut Rice,1/2 Cup Serving,375.9718,20.311,16.8087,7.6189,181.5329,42.2829,1.2571,1.849,5.7527,27.2083,5.337,True,"Milk Coconut 6 x #10 (Coconut Milk, Water, Polysorbate 60, Guar Gum, Sodium Carboxyl Methyl Cellulose, Sodium Metabisulfite (Preservative).), Water (Water), Rice Long Grain (Long Grain Rice Enriched With Iron (Ferric Orthophosphate), Niacin, Thiamin (Thiamin Mononitrate), And Folic Acid.), Spice Cinnamon Stick 3"", Butter Solids (Pasteurized Cream, Salt), Coconut (Desiccated Coconut Processed With Sugar, Propylene Glycol (Preservative), Salt, Sodium Metabisulfite (Preservative To Retain Whiteness)), Coarse Kosher Salt (Salt, Yellow Prussiate Of Soda)","['Coconut', 'Milk', 'Vegetarian']"
c4e2cb5e-7e0a-42cf-ba3c-7ac2e98a954d,Sweet Potato Wedge Fries,6 oz Serving,320.1826,12.0068,2.0012,0mg,380.2168,50.0286,2.0012,16.0092,2.0012,60.0342,0.8005,True,"Potato Sweet French Fry Wedge Cut (Sweet Potatoes, Vegetable Oil (Contains One Or More Of The Following Oils: Canola, Soybean, Cottonseed, Sunflower, Corn), Corn Starch Modified, Potato Starch Modified, Contains 2% Or Less Of: Baking Soda, Dextrin, Extractives Of Paprika And Turmeric (Color), Fiber (Pea, Corn, Molasses Powder (Refiners Syrup, Molasses), Rice Flour, Salt, Sodium Acid Pyrophosphate (Maintains Natural Color & Leavening), Sugar, Xanthan Gum.)","['Soy', 'Vegetarian', 'Vegan']"
2789a403-2866-40f3-93f9-ad70959a268a,Spicy Sausage Fennel Pasta,Cup,698.8578,24.1849,11.3421,95.8035,3039.5723,88.5755,5.444,4.2113,34.047,113.2623,4.7941,False,"Water (Water), Pasta Cellentani Cavatappi 20# (Semolina Wheat, Durum Wheat Flour, Vitamin B3 Niacin, Iron Ferrous Sulfate, Vitamin B1 Thiamine Mononitrate, Vitamin B2 Riboflavin, Folic Acid.), Pork Sausage (Pork Boston Butt, Water, Seasoning Sausage Mild (Blended of Salt, Red Pepper, Sage, Sugar, And Black Pepper).), Heavy Cream (Cream (Milk), Carrageenan.), Butter Solids (Pasteurized Cream, Salt), Shredded Parmesan Cheese (Parmesan Cheese (Pasteurized Part-Skim Cow’s Milk, Cheese Cultures, Salt, Enzymes), Potato Starch And Powdered Cellulose Added To Prevent Caking, Natamycin (A Natural Mold Inhibitor).), Iodized Salt (Salt, Sodium Silicoaluminate, Dextrose, Potassium Iodine), Lemon Zest (Lemon (Lemons Fresh)), Canola/Olive Oil Blend (Canola Oil, Extra Virgin Olive Oil), Minced Garlic (Peeled Garlic), Coarse Kosher Salt (Salt, Yellow Prussiate Of Soda), Spice Fennel Seed Whole 1 Gal (Fennel Seeds), Herb Parsley 60 Ct. (Parsley), Herb Oregano 2/3 oz. (Oregano), Spice Paprika 18 oz (Paprika), Spice Pepper Black Ground 18 oz (Black Pepper), Crushed Red Pepper (Crushed Red Pepper), Coarse Kosher Salt (Salt, Yellow Prussiate Of Soda), Lemon Juice Fresh Squeezed (Lemon (Lemons Fresh))","['Gluten', 'Milk', 'Wheat']"
faa05f02-8a46-4323-b07c-cb90ffdc03b8,Lemon Crunch Pie,10 Cut Serving,371.1604,14.0439,6.0188,30.0941,391.2231,58.1819,0g,29.091,4.0125,15.0471,2.0063,True,"Pie Lemon Crunch Unbaked 10"" CP (Water, Enriched Flour (Wheat Flour, Niacin, Reduced Iron, Thiamine Mononitrate, Riboflavin, Folic Acid), Sugar, Corn Syrup, Vegetable Oil (Palm, Soybean), Eggs, Modified Corn Starch, Contains 2% Or Less: Lemon Juice Concentrate, White Grape Juice Concentrate, Salt, Butter (Cream, Salt), Lemon Juice Solids, Natural Flavors, Cellulose Gel, Lemon Oil, Wheat Gluten, Mono- And Diglycerides, Colored With (Annatto Extract, Turmeric).)","['Eggs', 'Gluten', 'Milk', 'Soy', 'Vegetarian', 'Wheat']"
22b4da43-2aa0-4eef-8986-8cb9475dfc83,Ham Egg Cheese Croissant,Sandwich,430.7038,25.2246,11.004,136.5215,1072.5557,34.2829,1.2434,6.1312,16.7813,137.2771,2.1999,False,"Croissant (Enriched Flour (Wheat Flour, Malted Barley Flour, Niacin, Iron, Thiamine Mononitrate, Riboflavin, Folic Acid), Water, Margarine (Palm And Fractionated Palm Oil, Water, Soybean Oil, Sugar, Soy Lecithin, Monoglycerides, Preservatives [Potassium Sorbate, Citric Acid], Natural Flavor, Beta Carotene (Color), Vitamin A Palmitate), Wheat Flour, Sugar, Yeast, Contains 2% Or Less Of: Eggs, Salt, Egg Whites, Calcium Propionate (Preservative), Sodium Stearoyl Lactylate, Dough Conditioners (L-Cysteine, Ascorbic Acid, Enzymes).), Smoked Ham (36% Of Weight Is Added Ingredients. Cured With Water, Dextrose, Salt, Modified Cornstarch, Corn Syrup, Sodium Phosphates, Sodium Erythorbate, Sodium Nitrite.), Egg Patty Scrambled  Round 3.5"" (Whole Eggs, Water, Soybean Oil, Modified Food Starch, Whey Solids, Salt, Nonfat Dry Milk And Citric Acid.), American Cheese (Cultured Milk And Skim Milk, Cream, Sodium Citrate, Salt, Color Added, Sorbic Acid (Preservative), Enzymes, Soy Lecithin (Non-Sticking Agent).)","['Eggs', 'Gluten', 'Milk', 'Soy', 'Wheat']"
2e8d30f9-84a1-4ef5-a692-27a47af3a020,Sliced Pepperoni,Slice,8.8592,0.8269,0.2953,1.7718,33.0744,0g,0g,0g,0.2953,,,False,"BHA, BHT With Citric Acid Added To Help Protect Flavor, Pork And Beef, Salt, Contains 2% Or Less Of: Water, Dextrose, Spices, Lactic Acid Starter Culture, Oleoresin Of Paprika, Garlic Powder, Sodium Nitrite, Citric Acid, BHA, BHT.",[]
fdd7164a-243e-46c4-b72f-ea98e4fb4e5b,BBQ Firebraised Chicken,4 oz Serving,183.9731,6.2774,1.5693,88.9297,481.1866,12.3334,0g,11.6482,18.8322,,0.7533,False,"Chicken Thigh Bnls Sknls Fire Braise (Chicken Thigh Meat, Water, Contains 2 Or Less Of Spices, Salt, Flavoring, Paprika, Olive Oil, Xanthan Gum.), Sweet Baby Ray's BBQ Sauce (High Fructose Corn Syrup, Distilled Vinegar, Tomato Paste, Modified Food Starch, Contains Less Than 2% Of: Salt, Pineapple Juice Concentrate, Natural Smoke Flavor, Spice, Caramel Color, Molasses, Sodium Benzoate (Preservative), Dried Garlic, Mustard Flour, Corn Syrup, Sugar, Tamarind, Natural Flavor, Celery Seed.)",[]
d9eb473d-732a-41a4-ad71-59b973124bc5,Banana,Banana,131.2015,0.4865,0.1651,0mg,1.4742,33.6701,3.8329,18.0291,1.6068,7.3709,0.3833,True,,"['Vegetarian', 'Vegan']"
5befb4c1-9fe2-4d58-aead-4721a7df022b,Thin Cut Fries,5.5 oz Serving,188.2196,6.5153,0.7239,0mg,227.4036,30.4047,1.4479,0g,2.8958,,0.8687,True,"Thin Cut Fries (Potatoes, Vegetable Oil (Soybean, Canola, And/Or Cottonseed), Contains Less Than 2% Of Dextrose, Disodium Dihydrogen Pyrophosphate (To Maintain Natural Color).), Iodized Salt (Salt, Sodium Silicoaluminate, Dextrose, Potassium Iodine)","['Soy', 'Vegetarian', 'Vegan']"
00bee7d7-b8d5-42ee-b468-f71fbd044d34,Lemon Herb Garbanzo Bean Salad,1/2 Cup ,110.1872,3.0166,0.1542,0mg,164.6846,16.7196,3.3304,4.4954,4.8715,27.1386,1.1452,True,"Beans Garbanzo (Prepared Chick Peas, Water, Salt, Calcium Chloride Firming Agent, Disodium Edta Promotes Color Retention.), Cucumber (Cucumber.), Diced Tomatoes (Tomato), Red Onion, Lemon Juice (Filtered Water, Lemon Juice Concentrate, Sodium Bisulfite (Preservative), Sodium Benzoate (Preservative), Lemon Oil), Lemon Zest (Lemon (Lemons Fresh)), Canola Oil (Canola Oil With TBHQ And Citric Acid Added To Help Protect Flavor. Dimethylpolysiloxane, An Antifoaming Agent, Added.), Iodized Salt (Salt, Sodium Silicoaluminate, Dextrose, Potassium Iodine), Oregano (Oregano), Spice Parsley Flakes","['Vegetarian', 'Vegan']"
1c42e330-cf56-4c6c-a603-fbd6ad1c4c2f,Battered Cauliflower,10 Piece Serving,154.8851,8.8506,1.1063,0mg,331.8966,16.5948,1.1063,1.1063,2.2126,,0.885,True,"Appetizer Cauliflower Battered (Cauliflower, Water, Bleached Wheat Flour, Yellow Corn Flour, Contains Less Than 2% of: Nonfat Dry Milk, Whey, Dried Whole Eggs, Spices (Including Mustard), Soy Flour, Dextrose, Leavening (Sodium Bicarbonate, Sodium Acid Pyrophosphate, Sodium Aluminum Phosphate, Monocalcium Phosphate), Modified Corn Starch, Sugar, Guar Gum, Methylcellulose, Mono and Diglycerides, Extractives of Paprika (Color), Oleoresin Turmeric (Color), Soybean Oil, Salt. Prefried In Vegetable Oil (Soybean and/or Canola Oil).)","['Eggs', 'Gluten', 'Milk', 'Soy', 'Vegetarian', 'Wheat']"
491f4ff3-597a-4d29-84cf-e33e04587a1c,Gujerati Sem Green Beans,1/2 Cup Serving,92.5121,4.2128,0.3,0mg,580.6014,11.158,4.8938,2.8073,2.7521,50.1563,1.2067,True,"Whole Green Beans (Green Beans), Garlic Chopped (Minced Garlic (Peeled Garlic)), Canola Oil (Canola Oil With TBHQ And Citric Acid Added To Help Protect Flavor. Dimethylpolysiloxane, An Antifoaming Agent, Added.), Spice Black Mustard Seed 14 oz (Mustard Seeds.), Coarse Kosher Salt (Salt, Yellow Prussiate Of Soda), Granulated Sugar (Sugar.), Crushed Red Pepper (Crushed Red Pepper), Spice Pepper Black Ground 18 oz (Black Pepper)","['Vegetarian', 'Vegan']"
653e0677-6b6f-4d88-8ed3-d4fdae58283c,Double Chocolate Layer Cake,,,,,,,,,,,,,False,,[]
21c9dc15-1c15-470c-b608-927f0bca717a,Chicken And Noodles,Cup Serving,445.2396,17.7996,6.7768,162.1439,985.896,51.4255,1.5592,2.5259,18.8155,10.1188,3.5294,False,"Water (Water), Soup Cream Of Chicken (Chicken Stock, Modified Food Starch, Vegetable Oil, Wheat Flour, Cream, Contains Less Than 2% Of: Salt, Dried Chicken, Carrot Juice Concentrate, Soy Protein Concentrate, Chicken Fat, Yeast Extract, Flavoring, Dried Chicken Broth, Cane Sugar, Dried Onions, Celery Extract, Onion Extract.), Noodle Egg Reames 4 x 3# (Bleached Enriched Wheat Flour (Wheat Flour, Malted Barley Flour, Niacin, Ferrous Sulfate, Thiamine Mononitrate, Riboflavin, Folic Acid), Water, Egg Yolks, Eggs.), Chicken Thigh Bnls Sknls Fire Braise (Chicken Thigh Meat, Water, Contains 2 Or Less Of Spices, Salt, Flavoring, Paprika, Olive Oil, Xanthan Gum.), Butter Solids (Pasteurized Cream, Salt), Base Chicken No MSG (Chicken Meat Including Natural Chicken Juices, Salt, Sugar, Chicken Fat, Hydrolyzed Wheat, Corn, And Soy Proteins, Whey, Maltodextrin, 2% Or Less Of Onion Powder, Hydrogenated Cottonseed Oil, Disodium Inosinate And Disodium Guanylate, Corn Oil, Autolyzed Yeast Extract, Natural Extractives Of Turmeric And Annatto, Natural Flavors, Dextrose, Lactic Acid.), Ground Black Pepper (Black Pepper)","['Eggs', 'Gluten', 'Milk', 'Soy', 'Wheat']"
015eec36-22db-4d57-b899-915765bfbd26,"Flour Tortilla 8""",Tortilla,126.9428,2.9295,0.9765,0mg,273.4152,22.4591,0.9765,0g,2.9295,97.6483,0.9765,True,"Enriched Bleached Flour (Flour, Niacin, Reduced Iron, Thiamine Mononitrate, Riboflavin, Folic Acid), Water, Vegetable Shortening (Interesterified And Hydrogenated Soybean Oils), Contains 2% Or Less Of: Salt, Baking Soda, Sodium Acid Pyrophosphate, Distilled Monoglycerides, Enzymes, Cellulose Gum, Fumaric Acid, And Calcium Propionate And Sorbic Acid (To Maintain Freshness).","['Gluten', 'Soy', 'Vegetarian', 'Vegan', 'Wheat']"
ba8b1980-0361-43e5-a05e-22904aa82448,Salsa Verde,1/4 Cup Serving,121.9284,0.0266,0.0061,0mg,240.4112,4.8109,2.3645,0.7425,1.7754,109.8425,1.0063,True,"Tomatillo Whole Green 6 x #10 (Whole Tomatillos, Water, Citric Acid, And Salt.), Water (Water), Diced Onion, Pepper Chili Poblano 10# (Poblano Chili Pepper), Jalapeno Peppers (Jalapeno Pepper.), Minced Garlic (Peeled Garlic), Cilantro (Cilantro), Coarse Kosher Salt (Salt, Yellow Prussiate Of Soda)","['Vegetarian', 'Vegan']"
c86bd50e-32fb-42f5-87db-3c5abdaf9732,Mango Chutney,Tablespoon,26.4613,0.7395,0.0538,0mg,18.9842,4.9601,0.3637,5.7936,0.2326,4.7289,0.0892,True,"Mango Cubes (Mango.), Red Onion, Juice Pineapple 100% 46 oz (Pineapple Juice, Ascorbic Acid (Vitamin C), Vitamin E And Vitamin A.), Vinegar Apple Cider (Made From The Juices Of Apples, Diluted With Water To A Uniform Pickling And Table Strength Of 5% (50 Grains) Acidity.), Brown Sugar (Sugar, Cane Molasses), Canola Oil (Canola Oil With TBHQ And Citric Acid Added To Help Protect Flavor. Dimethylpolysiloxane, An Antifoaming Agent, Added.), Ginger Root 30# Case (Ginger Root.), Spice Curry Powder 16 oz. (Spices, Turmeric (As Color), Salt, Red Pepper, Spice Extract), Coarse Kosher Salt (Salt, Yellow Prussiate Of Soda), Crushed Red Pepper (Crushed Red Pepper), Ground White Pepper","['Vegetarian', 'Vegan']"
f35d6654-fedd-43f2-8ee1-816f0b90ca38,Pickled Red Onion,Tablespoon,3.8577,0.0155,0.0028,0mg,180.6255,0.9037,0.4256,0.2554,0.1389,3.6157,0.0336,True,"Water (Water), Red Onion, Vinegar Apple Cider (Made From The Juices Of Apples, Diluted With Water To A Uniform Pickling And Table Strength Of 5% (50 Grains) Acidity.), Minced Garlic (Peeled Garlic), Coarse Kosher Salt (Salt, Yellow Prussiate Of Soda), Spice Fennel Seed 14 oz (Fennel Seeds), Dill Weed, Spice Bay Leaf Whole (Bay Leaf)","['Vegetarian', 'Vegan']"
51271aa3-dd6d-4bf0-9892-ec3f050e7814,Lemon Cream Cake,12 Cut Serving,166.6667,7.3333,4.6666,20.0,146.6667,24.0,0g,16.6666,2.0,20.0,0.3333,True,"Sugar, Water, Enriched Bleached Flour (Wheat Flour, Niacin, Iron, Thiamine Mononitrate, Riboflavin, Folic Acid), Skim Milk, Eggs, Hydrogenated Palm Kernel Oil, Vegetable Oil (Soybean, Palm), High Fructose Corn Syrup, Modified Corn Starch, Contains 2% Or Less: Corn Syrup, Lemon Juice Powder [Corn Syrup Solids And Natural Flavors (Lemon Juice Solids, Natural Flavors)], Leavening (Sodium Acid Pyrophosphate, Sodium Bicarbonate, Corn Starch, Monocalcium Phosphate), Lemon Juice Concentrate, Whole Wheat Flour, Salt, Corn Starch, Natural And Artificial Flavors, Gums (Carbohydrate, Xanthan, Gellan), Citric Acid, Soy Lecithin, Colored With (Beta-Carotene, Annatto Extract, Riboflavin, Turmeric), Disodium Phosphate, Polyglycerol Esters Of Fatty Acids, Polysorbate 60, Sodium Citrate, Lactose, Sodium Alginate, Wheat Starch, Milk Protein Concentrate, Propylene Glycol Monostearate, Monoglycerides, Molasses, Cinnamon, Lactylic Esters Of Fatty Acids, Calcium Sulfate.","['Eggs', 'Gluten', 'Milk', 'Soy', 'Vegetarian', 'Wheat']"
de5d773e-fd91-4553-bf37-4bb59a31429f,Cooked Carrots,1/2 Cup,29.2113,0.1085,0.0192,0mg,65.0995,6.8772,2.4204,3.9727,0.5341,26.7075,0.7428,True,Baby Carrots (Carrots),"['Vegetarian', 'Vegan']"
3549cf95-1698-49df-98a8-8fce25289c17,GF Alfredo Sauce,3/4 Cup,435.0874,38.8471,12.4311,62.1553,1103.2574,12.4311,0g,6.2155,9.3233,279.6991,,True,"GF Alfredo Sauce (Cream, Skim Milk, Water, Parmesan And Asiago Cheese Blend With Flavor (Parmesan And Asiago Cheeses [Cultured Milk, Salt, Enzymes], Enzyme Modified Parmesan Cheese [Cultured Milk, Water, Salt, Enzymes], Whey, Salt), Soybean Oil, Canola Oil, 2% Or Less Of Modified Cornstarch, Salt, Romano Cheese Made From Cow's Milk Cultured Milk, Salt, Enzymes), Lactose, Spice, Xanthan Gum, Datem, Mono- And Diglycerides, Seasoning (Cornstarch, Extractives Of Turmeric And Annatto, Natural Flavor), Seasoning (Maltodextrin, Flavor, Enzyme Modified Butterfat).)","['Milk', 'Soy', 'Vegetarian']"
b3d794da-31b6-4037-a73f-5c057c36a89e,Cheese Sauce,1/2 Cup Serving,251.5892,16.6872,9.2397,38.444,627.8746,12.7149,0.2363,2.025,10.7558,332.875,0.3827,True,"2% Milk, Cheese Velveeta Shredded 4 x 5# (Cheddar And Colby Cheeses (Milk, Cheese Culture, Salt, Enzymes, Annatto [Color]), Water, Whey Protein Concentrate, Skim Milk, Whey, Sodium Citrate, Milkfat, Salt, Sodium Phosphate, Sorbic Acid As A Preservative, Apocarotenal (Color), With Cellulose Powder Added To Prevent Caking), Shredded American Cheese (American Cheese Milk, Cheese Cultures, Salt, Enzymes, Water, Cream, Sodium Phosphate, Color Added, Salt, Lactic Acid, Sorbic Acid Preservative, Corn Starch, Anti-Caking Agent, Natamycin A Mold Inhibitor.), Flour All Purpose H&R Gold Medal (Bleached Wheat Flour, Malted Barley Flour, Niacin, Iron, Thiamin Mononitrate, Riboflavin, Folic Acid.), Margarine (Vegetable Oil Blend (Palm Oil And Soybean Oil), Water, Salt, Contains Less Than 2% Of Soy Lecithin, Vegetable Mono Diglycerides, Potassium Sorbate (A Preservative), Citric Acid, Natural Artificial Flavor, Beta Carotene (Color), Vitamin A Palmitate Added, Whey.), Iodized Salt (Salt, Sodium Silicoaluminate, Dextrose, Potassium Iodine)","['Gluten', 'Milk', 'Soy', 'Vegetarian', 'Wheat']"
43f440fb-cb78-450a-b7f0-6e6b8ca318d1,Diced Tomatoes,Tablespoon,2.0412,0.0227,0.0032,0mg,0.567,0.4411,0.1361,0.2982,0.0998,1.134,0.0306,True,Tomato,"['Vegetarian', 'Vegan']"
15b91261-ded2-471a-a4cb-11ed537b2fa4,Roasted Garlic Herb Fingerling Potatoes,4 oz. Serving,250.534,2.8376,0.2241,0mg,369.4506,52.7621,8.9584,1.5876,4.8648,38.5553,7.9832,True,"Potato Fingerling, Canola/Olive Oil Blend (Canola Oil, Extra Virgin Olive Oil), Coarse Kosher Salt (Salt, Yellow Prussiate Of Soda), Spice Garlic Herb Granulated 18 oz (Dehydrated Garlic, Spices, Dehydrated Onion, Orange Peel, Paprika (As Color), Red Pepper)","['Vegetarian', 'Vegan']"
e6710635-a4cd-45f7-8cb3-0969002d7eda,Guacamole Dip,Tablespoon,29.6995,2.475,0.495,0mg,64.3489,0.99,0.495,0g,0.495,,,True,"Avocado, Red Bell Pepper, Onion, Salt, Jalapeno Pepper, Garlic, Lime Juice Concentrate.","['Vegetarian', 'Vegan']"
17557a64-61a9-460c-9126-6ac15ca369ed,Rice Pilaf,1/2 Cup,243.1876,5.1411,0.356,0mg,226.0616,42.6721,1.1833,1.0159,6.1836,92.9786,2.851,True,"Water (Water), Rice White Long Grain Parboiled 25# (Enriched Parboiled Long Grain Rice (Parboiled Long Grain Rice, Vitamins And Minerals [Calcium (Calcium Carbonate), Iron (Iron Phosphate), Vitamin B1 (Thiamine Mononitrate), Folic Acid]).), Carrots Bulk Jumbo 50# (Carrots), Slivered Almonds (Almonds, Blanched.), Celery, Green Onion (Onion Green), Canola/Olive Oil Blend (Canola Oil, Extra Virgin Olive Oil), Herb Parsley 60 Ct. (Parsley), Base Vegetable Mirepoix Sauteed 6 x 1# (Sauteed Vegetable Puree Mix (Carrots, Onions, Celery), Salt, Sugar, Maltodextrin, Corn Oil, Less Than 2% Of Yeast Extract, Water, Potato Starch, Xanthan Gum, Natural Flavors, Carrot Juice Concentrate.), Seasoned Salt Lawry's (Salt, Sugar, Spices (Including Paprika And Tumeric), Onion, Cornstarch, Garlic, Tricalcium Phosphate (Prevents Caking), Natural Flavor, Paprika Oleoresin (For Color).)","['Tree Nuts', 'Vegetarian', 'Vegan']"
a33c5eae-d7b3-49ed-92cd-494c29d96217,Diced Onion,Tablespoon,9.6388,0.0241,0.0101,0mg,0.9639,2.2507,0.4097,1.0217,0.2651,5.5423,0.0506,True,Yellow Onion,"['Vegetarian', 'Vegan']"
2faf8828-0e29-4f39-966e-0859b6a8ad17,BBQ Tofu and Peppers,Cup Serving,319.5871,6.352,0.9953,0mg,1027.5563,51.2101,2.91,39.8369,14.8957,166.5699,3.6045,True,"Tofu (Non-GMO Soybeans, Water, Calcium Sulfate, Glucono Delta Lactone (GDL).), Ken's Cannonball BBQ Sauce (Sugar, Distilled Vinegar, Water, Tomato Paste, Molasses, Modified Potato Starch, Salt, Contains Less Than 2% Of Natural Smoke Flavor, Mustard Flour, Spice, Paprika, Onion, Garlic, Caramel Color, Maltodextrin, Chili Powder (Chili Pepper, Spice, Salt, Garlic), Autolyzed Yeast Extract, Natural Flavor.), Red Pepper (Red Pepper), Green Pepper (Green Pepper), Onion White Slab Sliced 4 x 5#","['Soy', 'Vegetarian', 'Vegan']"
bcaa98dc-ea5a-4814-aeff-02ddf9908fac,Burrito Bar,,,,,,,,,,,,,False,,[]
5dfaea2b-28e8-4f14-95f8-1f78db142d30,Devilsfood Cake With Caramel Frosting,8x10 Cut Serving,231.1832,7.4098,3.4341,10.84,249.6275,39.3938,1.575,30.1345,2.1744,30.8031,0.9387,True,"Mix Cake Devils Food GM 6 x 5# (Sugar, Enriched Flour Bleached (Wheat Flour, Niacin, Iron, Thiamin Mononitrate, Riboflavin, Folic Acid), Palm Oil, Cocoa Processed With Alkali, Eggs With Sodium Silicoaluminate. Contains 2% Or Less Of: Leavening (Baking Soda, Monocalcium Phosphate), Nonfat Milk, Modified Corn Starch, Egg White, Propylene Glycol Mono And Diesters, Salt, Modified Whey, Mono And Diglycerides, Xanthan Gum, Natural Flavor, Defatted Soy Flour.), Water (Water), Powdered Sugar (Sugar, Carnauba Wax), Brown Sugar (Sugar, Cane Molasses), Margarine (Vegetable Oil Blend (Palm Oil And Soybean Oil), Water, Salt, Contains Less Than 2% Of Soy Lecithin, Vegetable Mono Diglycerides, Potassium Sorbate (A Preservative), Citric Acid, Natural Artificial Flavor, Beta Carotene (Color), Vitamin A Palmitate Added, Whey.), Water (Water), Milk Evaporated (Milk, Dipotassium Phosphate, Carrageenan, And Vitamin D3.), Flavor Vanilla Imitation (Water, Caramel Color, Artifical Flavor, Citric Acid, Sodium Benzoate (Preservative).)","['Eggs', 'Gluten', 'Milk', 'Soy', 'Vegetarian', 'Wheat']"
c66ad17f-36e2-4597-a055-781da0da5a62,Cinnamon Swirl Cake,8x10 Cut Serving,226.2809,5.7741,3.0416,5.5686,248.8505,42.4205,0.2633,30.8486,1.5424,23.7776,0.895,True,"Mix Cake White (Enriched Bleached Flour (Wheat Flour, Niacin, Reduced Iron, Thiamin Mononitrate, Riboflavin, Folic Acid), Sugar, Palm And Soybean Oil, Dextrose, Less Than 2% Of: Aluminum Sulfate, Artificial Flavor, Ascorbic Acid, Baking Soda, Food Starch-Modified, Mono And Di-Glycerides, Nonfat Milk, Polysorbate 60, Propylene Glycol Ester, Salt, Sodium Aluminum Phosphate, Soy Lecithin.), Water (Water), Powdered Sugar (Sugar, Carnauba Wax), Cream Cheese (Pasteurized Milk And Cream, Whey Protein Concentrate, Whey, Salt, Carob Bean Gum, Xanthan Gum, Guar Gum, Natamycin A Natural Mold Inhibitor, Vitamin A Palmitate, Cheese Culture.), Brown Sugar (Sugar, Cane Molasses), Granulated Sugar (Sugar.), Margarine (Vegetable Oil Blend (Palm Oil And Soybean Oil), Water, Salt, Contains Less Than 2% Of Soy Lecithin, Vegetable Mono Diglycerides, Potassium Sorbate (A Preservative), Citric Acid, Natural Artificial Flavor, Beta Carotene (Color), Vitamin A Palmitate Added, Whey.), Ground Cinnamon, Cocoa Powder (Cocoa Processed With Alkali.), Flavor Vanilla Imitation (Water, Caramel Color, Artifical Flavor, Citric Acid, Sodium Benzoate (Preservative).)","['Eggs', 'Gluten', 'Milk', 'Soy', 'Vegetarian', 'Wheat']"
69b64f9f-ba9f-47ed-b979-14aa40b2ca8d,Corn Salsa,1/4 Cup,45.2631,0.9522,0.0072,0mg,146.5926,8.3573,1.1513,3.9821,1.5114,4.3153,0.1936,True,"Sweet Corn (Corn.), Lime Juice (Water, Lime Juice Concentrate, Sodium Benzoate (Preservative), Sodium Bisulfate (Preservative), Lime Oil.), Red Onion, Cilantro (Cilantro), Coarse Kosher Salt (Salt, Yellow Prussiate Of Soda), Spice Paprika Smoked Sweet 20oz (Paprika.), Cayenne Pepper (Red Pepper)","['Vegetarian', 'Vegan']"
7b888134-70e5-4f36-a780-5297420803a2,Taco Firebraised Chicken,4 oz Serving,178.7789,8.0461,1.9994,112.3322,740.9477,1.5225,0.1841,0g,23.8999,19.9709,1.1458,False,"Chicken Thigh Bnls Sknls Fire Braise (Chicken Thigh Meat, Water, Contains 2 Or Less Of Spices, Salt, Flavoring, Paprika, Olive Oil, Xanthan Gum.), Seasoning Taco 25# GF (Salt, Corn Syrup Solids, Spices, Dextroase, Dehydrated Onion, Paprika, Garlic Powder, Oleoresin Paprika, Spice Extractives And Less Than 2% Tricalcium Phosphate Added To Prevent Caking)",[]
035b0819-ca58-4c08-bfbc-7d73fa40b28e,Pepperoni Pizza,6 Cut Serving,664.9932,30.0939,14.5686,77.9612,1791.2048,72.431,3.3516,7.7364,31.872,467.7669,4.4558,False,"Dough Pizza Pan Sheeted 16"" (Enriched Unbleached Wheat Flour (Wheat Flour, Malted Barley Flour, Niacin, Iron as Ferrous Sulfate, Thiamine Mononitrate, Enzyme, Riboflavin, Folic Acid), Water, Yeast, High Fructose Corn Syrup, Conatans Less Than 2% of the Following: Salt, Soybean Oil, Wheat Gluten, Ascorbic Acid, Enzyme.), Shredded Cheese (Paseurized Milk, Cheese Cultures, Salt, Enzymes.), Heinz Tomato Pizza Sauce (Tomato Puree, (Water, Tomato Paste), Salt, Sugar, Extra Virgin Olive Oil, Spices, Garlic Powder, Ascorbic Acid.), Sliced Pepperoni (BHA, BHT With Citric Acid Added To Help Protect Flavor, Pork And Beef, Salt, Contains 2% Or Less Of: Water, Dextrose, Spices, Lactic Acid Starter Culture, Oleoresin Of Paprika, Garlic Powder, Sodium Nitrite, Citric Acid, BHA, BHT.), >in Cans=","['Gluten', 'Milk', 'Soy', 'Wheat']"
a4f31355-17f9-461e-a5b4-c17b512d6a66,Sundried Tomato Risotto,1/2 Cup Serving,261.3661,13.4441,8.4765,45.5603,485.3982,28.0245,2.8548,3.2422,4.1892,87.6582,0.8167,True,"Cream Half & Half Fresh (Milk, Cream, Sodium Citrate, Sodium Phosphate.), Water (Water), Rice Arborio 2 x 5# (Arborio Rice.), Heavy Cream (Cream (Milk), Carrageenan.), Heavy Cream (Cream (Milk), Carrageenan.), Tomato Sundried 5# (Sun-Dried Tomatoes, Salt. Contains 2% Or Less
Glucose Syrup, Citric Acid, Sulfur Dioxide (For
Color Retention), Potassium Sorbate.), Diced Onion, Cheese Asiago Shredded (Asiago Cheese (Pasteurized Milk, Cheese Cultures, Salt, Enzymes), Powdered Cellulose (To Prevent Caking).), Minced Garlic (Peeled Garlic), Tomato Sundried 5# (Sun-Dried Tomatoes, Salt. Contains 2% Or Less
Glucose Syrup, Citric Acid, Sulfur Dioxide (For
Color Retention), Potassium Sorbate.), Base Vegetable Mirepoix Sauteed 6 x 1# (Sauteed Vegetable Puree Mix (Carrots, Onions, Celery), Salt, Sugar, Maltodextrin, Corn Oil, Less Than 2% Of Yeast Extract, Water, Potato Starch, Xanthan Gum, Natural Flavors, Carrot Juice Concentrate.), Olive Oil (Extra Virgin Olive Oil.), Coarse Kosher Salt (Salt, Yellow Prussiate Of Soda), Spice Pepper Black Coarse Grind 5# (Black Pepper)","['Milk', 'Vegetarian']"
