ItemID,Name,ServingSize,Calories,TotalFat,SaturatedFat,Cholesterol,Sodium,TotalCarbohydrate,DietaryFiber,Sugars,Protein,Calcium,Iron,IsVegetarian,Ingredients,Allergens
a3b487be-dbd9-46e6-b7fa-b7da84e89c6b,Indian Kidney Beans,1/2 Cup Serving,84.0262,1.7355,0.1336,0mg,222.4286,12.9377,3.3023,2.1289,4.0357,6.4422,0.4447,True,"Kidney Beans (Prepared Kidney Beans, Water, Sugar, Dextrose, Salt, Calcium Chloride Firming Agent, And Disodium EDTA To Promote Color Retention.), Tomato Puree 6 x #10 (Tomato Puree (Water, Tomato Paste), Citric Acid.), Yellow Onion, Canola Oil (Canola Oil With TBHQ And Citric Acid Added To Help Protect Flavor. Dimethylpolysiloxane, An Antifoaming Agent, Added.), Spice Ground Turmeric 1# (Ground Turmeric), Iodized Salt (Salt, Sodium Silicoaluminate, Dextrose, Potassium Iodine), Garlic Chopped (Minced Garlic (Peeled Garlic)), Ground Cumin (Cumin), Spice Coriander Ground 16 oz (Coriander), Spice Indian Chhole Masala 3.5 oz (Coriander, Dry Mango, Cumin, Cassia, Clove, Chilli, Black Pepper, Mint, Fennel, Pomegranate Seed, Dry Ginger, Salt, Nutmeg, Mace, Caraway, Cardamon, Turmeric, Mustard.), Ginger Root 30# Case (Ginger Root.), Spice Chili Powder Mild 18 oz (Chili Pepper And Other Spices, Salt, Garlic)","['Vegetarian', 'Vegan']"
aa515145-c94f-46ee-8cc0-3047b5a79333,Salted Caramel Brownie,8 x 10 Cut Serving,168.031,4.422,1.944,0mg,301.9889,29.2276,0.972,20.1041,1.944,,1.2636,True,"Mix Brownie Gm (Sugar, Enriched Flour, Bleached (Wheat Flour, Niacin, Iron, Thiamin Mononitrate, Riboflavin, Folic Acid), Palm Oil, Cocoa Processed With Alkali, Soybean Oil. Contains 2% Or Less Of: Corn Starch, Egg White, Salt, Leavening (Baking Soda, Monocalcium Phosphate), Natural Flavor, Soy Flour, Nonfat Milk.), Water (Water), Caramel Topping (Corn Syrup, Water, Sweetened Condensed Milk (Condensed Milk, Sugar), Less Than 2% Of: Modified Corn Starch, Sugar, Salt, Butter (Cream, Salt), Disodium Phosphate, Soy Lecithin, Xanthan Gum, Molasses, Caramel Color, Propylene Glycol, Barley Malt Extract, Caramel Color, Natural Flavor And Artificial Flavors.), Coarse Kosher Salt (Salt, Yellow Prussiate Of Soda)","['Eggs', 'Gluten', 'Milk', 'Soy', 'Vegetarian', 'Wheat']"
690a34fd-7111-46d0-b422-f85c8b7871d3,Ham and Cheese Quiche,8 Cut Serving,259.3119,16.3072,8.0345,108.8291,491.2409,14.4525,0.033,1.0416,9.454,141.8117,0.3781,False,"Cream Half & Half Fresh (Milk, Cream, Sodium Citrate, Sodium Phosphate.), Egg Scrambled Mix Frozen (Whole Eggs, Reconstituted Nonfat Dry Milk, Egg Whites, Corn Oil, Salt, Xanthan Gum, Citric Acid, Natural Flavoring, Annatto (A Natural Color).), Pie Shell Raw 10"" (Enriched Flour (Wheat Flour, Niacin, Reduced Iron, Thiamine Mononitrate, Riboflavin, Folic Acid), Shortening (Interesterified Soybean Oil, Fully Hydrogenated Cottonseed Oil), Water, Contains 2% Or Less: White Grape Juice Concentrate, Salt, Citrus Fiber, Xanthan Gum.), Diced Ham (Cured With Water, Salt, Sodium Phosphate, Potassium Acetate, Sodium Erythorbate, Potassium Diacetate, Sodium Nitrite), Shredded Cheddar Cheese (Pasteurized Milk, Cheese Culture, Salt, Enzymes, And Annatto (Color) When Applicable.), Spice Mustard Ground, Ground White Pepper","['Eggs', 'Gluten', 'Milk', 'Soy', 'Wheat']"
95aa44ed-4d82-4ae9-a33a-d5a181adde71,"Flour Tortilla 6""",Each,93.2567,2.4686,1.0971,0mg,175.5415,14.8113,0.5486,0g,2.7428,109.7134,0.5924,True,"Enriched Wheat Flour (Wheat Flour, Niacin, Reduced Iron, Thiamine Mononitrate, Riboflavin, Folic Acid), Water, Palm Oil, Contains 2% Or Less Of: Tortilla Mix (Salt, Vital Wheat Gluten, Leavening (Sodium Bicarbonate, Sodium Aluminum Sulfate, Sodium Aluminum Phosphate), Preservative (Calcium Propionate), Dextrose, Dough Conditioners (Monoglycerides, Mono And Diglycerides, Enzymes And Sodium Metabisulfite), Fumaric Acid, Guar Gum And Sorbic Acid).","['Gluten', 'Vegetarian', 'Vegan', 'Wheat']"
8e284891-0950-44ec-bc53-73cde19b5f7a,Farina,4 oz Ladle,364.598,1.2154,0g,0mg,154.7722,80.2116,2.4306,0g,12.1533,,30.6262,True,"Water (Water), Cereal Farina (Farina (Wheat), Reduced Iron, Niacin, Thiamin Mononitrate, Riboflavin, Folic Acid.), Iodized Salt (Salt, Sodium Silicoaluminate, Dextrose, Potassium Iodine)","['Gluten', 'Vegetarian', 'Vegan', 'Wheat']"
ec7eb998-a992-48ef-a683-9aa5b038ff26,Primavera Fregola Sauce,Cup,95.2155,4.4956,0.2483,0mg,744.8817,11.4538,2.7589,6.8887,2.1058,19.9139,0.7632,True,"Marinara Sauce (Tomato Puree (Water, Tomato Paste), Diced Tomatoes, Less Than 2% Of: Sugar, Soybean Oil, Salt, Spice, Dired Garlic, Dried Onion, Olive Oil, Citric Acid, Sea Salt, Natural Flavor.), Water (Water), Mirepoix (Diced Onion, Celery, Canola Oil (Canola Oil With TBHQ And Citric Acid Added To Help Protect Flavor. Dimethylpolysiloxane, An Antifoaming Agent, Added.), Carrots Bulk Medium 25# (Carrots)), Tomato Paste 6 x #10 (Tomato Paste, Citric Acid.), Base Vegetable Mirepoix Sauteed 6 x 1# (Sauteed Vegetable Puree Mix (Carrots, Onions, Celery), Salt, Sugar, Maltodextrin, Corn Oil, Less Than 2% Of Yeast Extract, Water, Potato Starch, Xanthan Gum, Natural Flavors, Carrot Juice Concentrate.)","['Soy', 'Vegetarian', 'Vegan']"
a7c42a7c-2777-49a1-b0e3-a16a96eb84a0,Country Gravy,3/4 Cup ,345.2048,22.3986,13.8522,63.276,1698.1124,27.1608,1.2016,0.0929,9.09,242.6813,1.3579,True,"2% Milk, Butter Solids (Pasteurized Cream, Salt), Flour All Purpose H&R Gold Medal (Bleached Wheat Flour, Malted Barley Flour, Niacin, Iron, Thiamin Mononitrate, Riboflavin, Folic Acid.), Coarse Kosher Salt (Salt, Yellow Prussiate Of Soda), Garlic Seasoning (Garlic Powder.), Spice Pepper Black Ground 18 oz (Black Pepper), Crushed Red Pepper (Crushed Red Pepper)","['Gluten', 'Milk', 'Vegetarian', 'Wheat']"
2487faab-5a59-4b11-96bd-cfd9a37d84cf,Sugar Cream Pie,10 Cut Serving,329.8063,19.0342,11.0198,39.0124,240.091,35.1203,0.073,21.6241,2.4841,50.2527,0.0081,True,"Cream Half & Half Fresh (Milk, Cream, Sodium Citrate, Sodium Phosphate.), Pie Shell Raw 10"" (Enriched Flour (Wheat Flour, Niacin, Reduced Iron, Thiamine Mononitrate, Riboflavin, Folic Acid), Shortening (Interesterified Soybean Oil, Fully Hydrogenated Cottonseed Oil), Water, Contains 2% Or Less: White Grape Juice Concentrate, Salt, Citrus Fiber, Xanthan Gum.), Granulated Sugar (Sugar.), Butter Solids (Pasteurized Cream, Salt), Gel Clear Instant Corn Starch 50# (Corn Starch.), Flavor Vanilla Imitation (Water, Caramel Color, Artifical Flavor, Citric Acid, Sodium Benzoate (Preservative).), Ground Cinnamon","['Gluten', 'Milk', 'Soy', 'Vegetarian', 'Wheat']"
3a3208a6-23df-48cd-bb07-8cfaa0ea0d06,Cherry Nut Crisp,5x8 Cut Serving,257.5189,8.5193,2.4105,0mg,91.5907,43.1265,1.3406,28.4509,2.3957,21.9464,0.8656,True,"Cherry Pie Filling (Cherries, Water, High Fructose Corn Syrup, Food Starch-Modified (Corn), Sugar, Potassium Sorbate (Preservative), Citric Acid, Ascorbic Acid Added To Protect Color, Carageenan, Red 40 Color.), Brown Sugar (Sugar, Cane Molasses), Cereal Oats Quick (Whole Grain Rolled Oats.), Flour All Purpose H&R Gold Medal (Bleached Wheat Flour, Malted Barley Flour, Niacin, Iron, Thiamin Mononitrate, Riboflavin, Folic Acid.), Margarine (Vegetable Oil Blend (Palm Oil And Soybean Oil), Water, Salt, Contains Less Than 2% Of Soy Lecithin, Vegetable Mono Diglycerides, Potassium Sorbate (A Preservative), Citric Acid, Natural Artificial Flavor, Beta Carotene (Color), Vitamin A Palmitate Added, Whey.), Walnut Pieces, Baking Soda 24 x 1# (Sodium Bicarbonate), Baking Powder 4 x 10# (Sodium Acid Pyrophosphate, Sodium Bicarbonate, Corn Starch, Monocalcium Phosphate)","['Gluten', 'Milk', 'Soy', 'Tree Nuts', 'Vegetarian', 'Wheat']"
c58ad233-139c-44e8-b184-9a8b677eb564,Spinach and Cheese Strata,4x4 Cut Serving,201.0531,10.6257,5.3157,117.4882,853.6835,14.9031,1.3969,1.9333,11.0121,278.1018,1.3089,True,"2% Milk, Spinach Chopped Frozen (12 x 3#), Egg Whole Frozen (Egg (Whole Frozen)), Texas Toast (Enriched Flour [Unbleached Wheat Flour, Malted Barley Flour, Reduced Iron, Thiamine Mononitrate (Vitamin B1), Riboflavin (Vitamin B2), Niacin (Vitamin B3), Folic Acid], Water, Sugar, Yeast, Soybean Oil, Salt, Wheat Gluten, Vinegar, Calcium Propionate (A Preservative), Yellow Corn Flour, Monoglycerides, Annatto Extract And Turmeric Added For Color, Wheat Starch, Calcium Sulfate, Potassium Chloride, Sodium Stearoyl Lactylate, Calcium Phosphate, Ascorbic Acid, Sesame.), Yellow Onion, Shredded Swiss Cheese (Pasteurized Part-Skim Milk, Cheese Culture, Salt, Enzymes, Potato Starch (Anti-Caking), Cellulose (Anti-Caking)), Grated Parmesan Cheese (Grated Parmesan (Pasteurized Cow’s Milk, Salt, Enzymes), Powdered Cellulose Added To Prevent Caking.), Butter Solids (Pasteurized Cream, Salt), Coarse Kosher Salt (Salt, Yellow Prussiate Of Soda), Coarse Kosher Salt (Salt, Yellow Prussiate Of Soda), Spice Pepper Black Ground 18 oz (Black Pepper), Ground Nutmeg","['Eggs', 'Gluten', 'Milk', 'Sesame', 'Soy', 'Vegetarian', 'Wheat']"
538f6f1b-e266-42da-bb57-4e96da5d6353,Tortilla Chips,Ounce,141.7475,7.0874,1.0125,0mg,121.4978,18.2247,1.0125,0g,2.025,,,True,"Corn, Vegetable Oil (Corn, Canola And/Or Sunflower Oil), And Salt.","['Vegetarian', 'Vegan']"
0cab9e9b-7912-4424-9a40-90c2a89b1c13,GF Rotini,1/2 Cup Serving,72.1394,0.3796,0g,0mg,863.9565,16.7058,0.7592,0g,1.5188,0.7592,,True,"Water (Water), GF Pasta (Corn Flour, Rice Flour, Mono And Diglycerides.), Coarse Kosher Salt (Salt, Yellow Prussiate Of Soda)","['Vegetarian', 'Vegan']"
444e348e-9719-44cf-bdca-2ab2cff6579a,Blueberry Swirl Cheesecake Squares,8x10 Cut Serving,210.0674,13.5764,7.3273,59.251,207.5942,20.5458,0.5236,15.6367,2.8473,62.1779,0.3626,True,"Cream Cheese (Pasteurized Milk And Cream, Whey Protein Concentrate, Whey, Salt, Carob Bean Gum, Xanthan Gum, Guar Gum, Natamycin A Natural Mold Inhibitor, Vitamin A Palmitate, Cheese Culture.), Blueberries (Blueberries.), Graham Cracker Crumbs (Whole Wheat Flour, Enriched Flour (Wheat Flour, Niacin, Reduced Iron, Vitamin B1 (Thiamin Mononitrate), Vitamin B2 (Riboflavin), Folic Acid), Sugar, Vegetable Oil (Soybean And/Or Canola Oil), Molasses, Honey, Corn Syrup, Contains 2% Or Less Of Leavening (Baking Soda, Sodium Acid Pyrophosphate, Monocalcium Phosphate), Natural Flavors, Salt, Soy Lecithin.), Granulated Sugar (Sugar.), Egg Whole Frozen (Egg (Whole Frozen)), 2% Milk, Butter Solids (Pasteurized Cream, Salt), Granulated Sugar (Sugar.), Granulated Sugar (Sugar.), Lemon Juice (Filtered Water, Lemon Juice Concentrate, Sodium Bisulfite (Preservative), Sodium Benzoate (Preservative), Lemon Oil), Flavor Vanilla Imitation (Water, Caramel Color, Artifical Flavor, Citric Acid, Sodium Benzoate (Preservative).)","['Eggs', 'Gluten', 'Milk', 'Soy', 'Vegetarian', 'Wheat']"
12dcdfd6-d387-4718-8e22-0486f24b15f0,French Fried Zucchini,4 oz,159.9202,0.7269,0g,0mg,770.5249,33.4379,1.1543,0.7328,4.3615,29.0764,2.3261,True,"Breaded Zucchini Slices (Zucchini, Bleached Enriched Wheat Flour (Bleached Wheat Flour, Niacin, Reduced Iron, Thiamine Mononitrate, Riboflavin, Folic Acid), Bleached Enriched Wheat Flour (Wheat Flour, Niacin, Ferrous Sulfate, Thiamine Mononitrate, Riboflavin, Folic Acid), Water. Contains 2% Or Less Of Cellulose Gum, Cheddar Cheese (Milk, Cheese Culture, Salt, Enzymes), Dextrose, Dried Garlic, Dried Onion, Imitation Parmesan Cheese (Lactose, Corn Starch, Modified Corn Starch, Artificial Flavor), Imitation Romano Cheese (Corn Starch, Lactose, Modified Corn Starch, Artificial Flavor), Leavening (Sodium Acid Pyrophosphate, Sodium Bicarbonate), Modified Corn Starch, Paprika Oleoresin (Color), Parsley, Salt, Soybean Oil, Spices, Turmeric Oleoresin (Color), Whey, Yeast, Yellow 5, Yellow 6, Yellow Corn Flour.)","['Gluten', 'Milk', 'Soy', 'Vegetarian', 'Wheat']"
86012f74-9046-4051-b1fa-b9b6b8e0e269,Bread and Condiments,,,,,,,,,,,,,False,,[]
822c19be-d96e-407e-9f20-cacda24168ef,Cabbage Sauteed with Apples,Serving,117.0569,9.3465,5.8465,24.3806,546.369,8.9402,1.9754,5.5989,1.1842,36.1831,0.5946,True,"Cabbage Green Head 2 Ct (Green Cabbage), Water (Water), Gala Apples, Butter Solids (Pasteurized Cream, Salt), Lemon Juice (Filtered Water, Lemon Juice Concentrate, Sodium Bisulfite (Preservative), Sodium Benzoate (Preservative), Lemon Oil), Coarse Kosher Salt (Salt, Yellow Prussiate Of Soda), Granulated Sugar (Sugar.)","['Milk', 'Vegetarian']"
b0d45b9f-a660-446c-a250-7e6d6f8026e4,Sausage Pizza,6 Cut Serving,680.2826,28.2457,12.1936,59.5255,1714.86,78.0166,5.8557,9.6146,36.3348,415.5064,6.6285,False,"Dough Pizza Pan Sheeted 16"" (Enriched Unbleached Wheat Flour (Wheat Flour, Malted Barley Flour, Niacin, Iron as Ferrous Sulfate, Thiamine Mononitrate, Enzyme, Riboflavin, Folic Acid), Water, Yeast, High Fructose Corn Syrup, Conatans Less Than 2% of the Following: Salt, Soybean Oil, Wheat Gluten, Ascorbic Acid, Enzyme.), Heinz Tomato Pizza Sauce (Tomato Puree, (Water, Tomato Paste), Salt, Sugar, Extra Virgin Olive Oil, Spices, Garlic Powder, Ascorbic Acid.), Shredded Cheese (Paseurized Milk, Cheese Cultures, Salt, Enzymes.), >in Cans=, Sausage Crumble Cooked Mild (Pork, Water, Textured Soy Flour, Seasoning (Salt, Spices And Dextrose, Garlic), Caramel Color.)","['Gluten', 'Milk', 'Soy', 'Wheat']"
df79537e-5130-4e1b-97b3-03010f71627d,Sweet Chili Sauce,Tablespoon,20.5711,0g,0g,0mg,47.9992,5.4856,0g,4.5714,0g,,,True,"Water, Sugar, Red Wine Vinegar, Red Bell Peppers (Red Bell Peppers, Vinegar, Salt, Potassium Sorbate And Sodium Benzoate [Preservatives], Calcium Chloride), Jalapeno Peppers (Jalapeno Peppers, Water, Salt, Vinegar, Calcium Chloride, Potassium Sorbate [Preservative], Capsicum Oleoresin), Modified Cornstarch, 2% Or Less Of Spices, Garlic, Xanthan Gum, Salt.","['Vegetarian', 'Vegan']"
f2ae8d4f-b1eb-4831-9e2c-a58217f4c938,Heinz Tomato Pizza Sauce,Ounce,14.1748,0g,0g,0mg,151.1973,2.3624,0.4725,1.4175,0.4725,,,True,"Tomato Puree, (Water, Tomato Paste), Salt, Sugar, Extra Virgin Olive Oil, Spices, Garlic Powder, Ascorbic Acid.","['Vegetarian', 'Vegan']"
0df0d1df-bc99-4a47-95d7-b76a9f0d3a9d,Sauteed Button Mushrooms,1/4 Cup,35.5688,3.1723,1.2583,0mg,157.5131,1.4966,0.626,0.6629,0.6146,1.7072,0.4922,True,"Mushroom Whole Button Fresh 10# (Raw Mushrooms.), Margarine (Vegetable Oil Blend (Palm Oil And Soybean Oil), Water, Salt, Contains Less Than 2% Of Soy Lecithin, Vegetable Mono Diglycerides, Potassium Sorbate (A Preservative), Citric Acid, Natural Artificial Flavor, Beta Carotene (Color), Vitamin A Palmitate Added, Whey.), Iodized Salt (Salt, Sodium Silicoaluminate, Dextrose, Potassium Iodine)","['Milk', 'Soy', 'Vegetarian']"
ddfa0d92-1b19-4ff8-9e09-03dd43687844,Sugar Cream Pie,10 Cut Serving,350.8251,17.5413,8.7707,35.8799,119.5995,44.6505,0.7974,24.7173,3.9867,66.1784,,False,"Pie Sugar Cream 10"" (Crust: Wheat Flour (Unenriched, Unbleached), Lard, Water, Salt, Dextrose, Baking Soda. Filling: Skim-Milk, Cream, Sugar, Wheat Flour (Unenriched, Unbleached), Butter (Sweet Cream, Salt), Artificial Flavoring, Salt, Nutmeg.)","['Gluten', 'Milk', 'Wheat']"
e03d8050-4ae0-40ab-a984-9288fc7e7afd,Baby Carrots with Leeks & Tarragon,1/2 Cup,100.0677,7.1458,2.2976,0mg,421.2199,8.2164,2.5941,4.2876,0.7427,35.8439,1.0364,True,"Baby Carrots (Carrots), Buttery Sticks Earth Balance (Vegetable Oil Blend (Palm Fruit, Canola, Soybean, Flax And Olive Oils), Water, Salt, Contains Less Than 2% Of Natural Flavor, Soy Protein, Soy Lecithin, Lactic Acid (To Protect Freshness), Annatto Extact (Color).), Leeks Fresh Bunch (Raw Leeks), Coarse Kosher Salt (Salt, Yellow Prussiate Of Soda), Spice Tarragon Leaf 4 oz (Tarragon)","['Soy', 'Vegetarian', 'Vegan']"
97f3f986-cb50-4537-b302-a65fcfc94fb9,Sliced Onions,Tablespoon,3.394,0.0085,0.0036,0mg,0.3394,0.7925,0.1442,0.3598,0.0933,1.9515,0.0178,True,,"['Vegetarian', 'Vegan']"
14be4eb7-0acb-47f0-9ed0-04e37c174815,Garlic Cheese Breadsticks,Each,186.7313,7.406,3.2006,8.7694,453.0778,23.4923,1.0226,0.9954,6.0609,119.6458,0.0744,True,"Breadstick Gourmet Parbaked Turano (Flour (Wheat Flour, Malted Barley), Water, Contains Less Than 2% Of Each Of The Following: Salt, Dextrose, Palm Oil, Wheat Gluten, Wheat Starch, Diacetyl Tartaric Acid Esters Of Mono-Diglycerides (Datem), L-Cysteine, Ascorbic Acid, Enzyme, Yeast, Mono- And Diglycerides, Ethoxylated Mono And Diglycerides, Polysorbate 60, Calcium Propionate (Preservative), Enriched Wheat Flour (Wheat Flour, Niacin, Reduced Iron, Thiamine Mononitrate, Riboflavin, Folic Acid). Topping: Water, Potassium Sorbate.), Shredded Cheese (Paseurized Milk, Cheese Cultures, Salt, Enzymes.), Garlic Butter Spread (Margarine (Vegetable Oil Blend (Palm Oil And Soybean Oil), Water, Salt, Contains Less Than 2% Of Soy Lecithin, Vegetable Mono Diglycerides, Potassium Sorbate (A Preservative), Citric Acid, Natural Artificial Flavor, Beta Carotene (Color), Vitamin A Palmitate Added, Whey.), Garlic Seasoning (Garlic Powder.), Coarse Kosher Salt (Salt, Yellow Prussiate Of Soda), Sweet Basil, Spice Pepper Black Ground 18 oz (Black Pepper), Oregano (Oregano), Spice Parsley Flakes)","['Gluten', 'Milk', 'Soy', 'Vegetarian', 'Wheat']"
9b980cda-4ff7-4f83-a3a6-7f084f44c3c8,Fresh Sliced Strawberries,4 oz Serving,31.2071,0.2926,0.0146,0mg,0.9752,7.4897,1.9504,4.7688,0.6534,15.6036,0.3998,True,Fresh Strawberries (Fresh Strawberries.),"['Vegetarian', 'Vegan']"
36c564ab-649b-48e7-afd4-db4f506f964a,Marinara Sauce,1/4 Cup,25.2487,0.7575,0g,0mg,196.9402,4.0398,1.0099,2.5249,1.0099,10.6045,0.505,True,"Marinara Sauce (Tomato Puree (Water, Tomato Paste), Diced Tomatoes, Less Than 2% Of: Sugar, Soybean Oil, Salt, Spice, Dired Garlic, Dried Onion, Olive Oil, Citric Acid, Sea Salt, Natural Flavor.)","['Soy', 'Vegetarian', 'Vegan']"
39708934-4c99-40c8-8d47-3a252d59da93,Lemon Thyme Rosemary Roasted Chicken,Serving,376.3739,23.0117,4.7913,106.2683,462.6862,3.9907,2.5347,0.4959,36.0522,35.7557,1.6544,False,"Chicken Breast Split Fresh 7 oz 44# Avg (Chicken), Lemon Zest (Lemon (Lemons Fresh)), Canola Oil (Canola Oil With TBHQ And Citric Acid Added To Help Protect Flavor. Dimethylpolysiloxane, An Antifoaming Agent, Added.), Minced Garlic (Peeled Garlic), Iodized Salt (Salt, Sodium Silicoaluminate, Dextrose, Potassium Iodine), Spice Thyme Leaf (Thyme Leaves), Spice Pepper Black Ground 18 oz (Black Pepper), Spice Rosemary Leaf 6 oz. (Rosemary)",[]
1755118e-2151-4c35-89f4-6022289fab31,Mexican Pizza,16 Cut Serving,273.7239,11.449,5.2742,26.6,668.7329,31.7623,1.8144,2.9716,12.717,251.0579,1.9854,True,"Dough Pizza Pan Sheeted 16"" (Enriched Unbleached Wheat Flour (Wheat Flour, Malted Barley Flour, Niacin, Iron as Ferrous Sulfate, Thiamine Mononitrate, Enzyme, Riboflavin, Folic Acid), Water, Yeast, High Fructose Corn Syrup, Conatans Less Than 2% of the Following: Salt, Soybean Oil, Wheat Gluten, Ascorbic Acid, Enzyme.), Shredded Cheddar & Mont. Jack Cheese (Pasteurized Milk, Cheese Cultures, Salt, Enzymes And Annatto (A Natural Vegetable Color) Cellulose Added To Prevent Caking.), Taco Sauce (Tomato Puree (Water, Tomato Paste), Water, Distilled Vinegar, Sugar, Salt, Modified Corn Starch, Paprika, Spices (Chili Pepper, Spices, Salt, Dehydrated Garlic), Citric Acid, Sodium Benzoate (Preservative), Xanthan Gum, Onion Powder.), Refried Beans (Cooked Beans, Water, Less Than 2% Of: Canola Oil, Salt, Distilled Vinegar, Chile Pepper, Onion Powder, Spices, Garlic Powder, Natural Flavor), Tortilla Chips (Corn, Vegetable Oil (Corn, Canola And/Or Sunflower Oil), And Salt.), Green Onion (Onion Green), Sliced Black Olives (Olives, Water, Salt And Ferrous Gluconate (Color Stabilizer).), Ground Cumin (Cumin)","['Gluten', 'Milk', 'Soy', 'Vegetarian', 'Wheat']"
4992cea2-643f-43bc-9536-ccc35579be5b,Garlic and Rosemary Eggplant,2 oz Portion,56.2529,4.6586,0.4111,0mg,232.096,4.0373,2.2727,2.1351,0.6866,7.935,0.1559,True,"Eggplant Bushel (Eggplant), Canola/Olive Oil Blend (Canola Oil, Extra Virgin Olive Oil), Minced Garlic (Peeled Garlic), Olive Oil (Extra Virgin Olive Oil.), Coarse Kosher Salt (Salt, Yellow Prussiate Of Soda), Herb Rosemary Frozen 5#, Spice Pepper Black Ground 18 oz (Black Pepper)","['Vegetarian', 'Vegan']"
3d0084a9-545a-4745-b4ac-6754042b7ff6,Boneless Chicken Wings,6 Piece Serving,313.0508,12.1742,2.6088,43.4792,991.3274,24.3484,0g,0g,17.3917,34.7834,1.7392,False,"Chicken BB 7206 PA Cntry Style Bnls Wing (Boneless Chicken Breast Meat With Rib Meat, Water, Seasoning (Modified Food Starch, Carrageenan), Salt, Sodium Phosphates. Breaded With Enriched Wheat Flour (Wheat Flour, Niacin, Reduced Iron, Thiamine Mononitrate, Riboflavin, Folic Acid), Wheat Flour, Water, Salt, Spices, Leavening (Monocalcium Phosphate, Sodium Bicarbonate), Wheat Gluten, Soybean Oil, White Corn Flour, Yellow Corn Flour, Dehydrated Garlic, Soy Flour, Dried Onion, Dried Garlic, Extractives Of Paprika, Spice Extractives.)","['Gluten', 'Soy', 'Wheat']"
01c96af9-4c7f-46cd-9d18-52d0ac180d53,Sundae Bar,,,,,,,,,,,,,False,,[]
1d80cbb3-d158-4139-a1e3-1eb03b51b4a8,Zucchini Bread,Slice,240.0087,10.901,0.9331,23.4069,182.9906,33.0078,0.8161,21.0618,2.4579,12.0125,0.9306,True,"Granulated Sugar (Sugar.), Flour All Purpose H&R Gold Medal (Bleached Wheat Flour, Malted Barley Flour, Niacin, Iron, Thiamin Mononitrate, Riboflavin, Folic Acid.), Canola Oil (Canola Oil With TBHQ And Citric Acid Added To Help Protect Flavor. Dimethylpolysiloxane, An Antifoaming Agent, Added.), Zucchini (Zucchini), Egg Whole Frozen (Egg (Whole Frozen)), Flavor Vanilla Imitation (Water, Caramel Color, Artifical Flavor, Citric Acid, Sodium Benzoate (Preservative).), Ground Cinnamon, Iodized Salt (Salt, Sodium Silicoaluminate, Dextrose, Potassium Iodine), Baking Soda 24 x 1# (Sodium Bicarbonate), Baking Powder 4 x 10# (Sodium Acid Pyrophosphate, Sodium Bicarbonate, Corn Starch, Monocalcium Phosphate)","['Eggs', 'Gluten', 'Vegetarian', 'Wheat']"
cf7a5441-35cc-416a-8745-77515536d22f,Cinnamon Muffin,Muffin,246.7077,6.9148,3.143,3.1367,370.8717,44.2109,0.6361,24.7043,1.8868,19.1172,1.1965,True,"Muffin Mix Variety (Enriched Flour Bleached (Wheat Flour, Niacin, Iron, Thiamin Mononitrate, Riboflavin, Folic Acid), Sugar, Palm Oil, Modified Corn Starch, Modified Whey. Contains 2% Or Less Of: Leavening (Sodium Acid Pyrophosphate, Baking Soda, Monocalcium Phosphate), Dextrose, Mono And Diglycerides, Salt, Eggs With Sodium Silicoaluminate, Xanthan Gum, Nonfat Milk, Natural Flavor, Soy Flour.), Water (Water), Granulated Sugar (Sugar.), Ground Cinnamon","['Eggs', 'Gluten', 'Milk', 'Soy', 'Vegetarian', 'Wheat']"
d61e5ee7-532a-443a-b81b-c12b7ff5c840,Hot Sandwich Toppings,,,,,,,,,,,,,False,,[]
01dc4582-330c-419f-9a45-c8ba72526fd9,Cream of Tomato Soup,6 oz Ladle,107.682,1.701,1.0587,7.0874,379.4012,18.292,0.9745,8.3333,4.3765,127.287,0.4609,True,"2% Milk, Soup Tomato Canned (Tomato Puree (Water, Tomato Paste), Wheat Flour, Sugar, Water, Contains Less Than 2% Of: Salt, Citric Acid, Ascorbic Acid (Vitamin C), Flavoring, Celery Extract, Garlic Oil.)","['Gluten', 'Milk', 'Vegetarian', 'Wheat']"
86597841-eb91-47e4-b101-2e5495635c32,Devilsfood Cake with Cream Cheese Frost,8x10 Cut Serving,206.7524,7.4658,3.6937,15.0561,258.4126,32.9055,1.575,23.7306,2.3278,35.4896,0.9002,True,"Mix Cake Devils Food GM 6 x 5# (Sugar, Enriched Flour Bleached (Wheat Flour, Niacin, Iron, Thiamin Mononitrate, Riboflavin, Folic Acid), Palm Oil, Cocoa Processed With Alkali, Eggs With Sodium Silicoaluminate. Contains 2% Or Less Of: Leavening (Baking Soda, Monocalcium Phosphate), Nonfat Milk, Modified Corn Starch, Egg White, Propylene Glycol Mono And Diesters, Salt, Modified Whey, Mono And Diglycerides, Xanthan Gum, Natural Flavor, Defatted Soy Flour.), Water (Water), Powdered Sugar (Sugar, Carnauba Wax), Cream Cheese (Pasteurized Milk And Cream, Whey Protein Concentrate, Whey, Salt, Carob Bean Gum, Xanthan Gum, Guar Gum, Natamycin A Natural Mold Inhibitor, Vitamin A Palmitate, Cheese Culture.), Margarine (Vegetable Oil Blend (Palm Oil And Soybean Oil), Water, Salt, Contains Less Than 2% Of Soy Lecithin, Vegetable Mono Diglycerides, Potassium Sorbate (A Preservative), Citric Acid, Natural Artificial Flavor, Beta Carotene (Color), Vitamin A Palmitate Added, Whey.), Flavor Vanilla Imitation (Water, Caramel Color, Artifical Flavor, Citric Acid, Sodium Benzoate (Preservative).)","['Eggs', 'Gluten', 'Milk', 'Soy', 'Vegetarian', 'Wheat']"
750cc1ef-6d71-4151-8598-fbe7d59d46bb,Sliced Strawberries,#8 Disher,126.9264,0g,0g,0mg,0mg,30.4623,0.8462,27.9238,0.8462,,,True,"Sliced Strawberries (Strawberries, Sugar.)","['Vegetarian', 'Vegan']"
a504a700-d57d-4f70-a3b9-30bf0da629f4,MYO Avocado Toast Bar,,,,,,,,,,,,,False,,[]
6203005a-5b7b-40c6-9557-0c4f20444157,Shepherds Pie Halal,4 x 8 Cut Serving,372.4134,22.9947,9.6144,70.2749,1107.2535,22.2067,2.9903,2.6636,19.0378,166.8245,2.0228,False,"Whipped Potatoes (Water (Water), Potato Mashed Instant Idahoan 26 oz (Idaho Potatoes, Salt, Sunflower Oil, Nonfat Dry Milk, Monoglycerides, Calcium Stearoyl Lactylate, Spice, Artificial Color, Natural And Artificial Flavors, Freshness Preserved By Sodium Acid Pyrophosphate, Sodium Bisulfite, Citric Acid And Mixed Tocopherols.)), Beef Ground Fine 80/20 60# Avg, Shredded Sharp Cheddar Cheese (Pasteurized Milk, Salt, Cheese Culture, Annatto Color.), Carrots Diced Frozen (Carrots), Peas (12 x 2.5#) (Peas, Salt), Water (Water), Diced Onion, Sauce Worcestershire 4 x 1 Gal (Distilled Vinegar, Molasses, Water, Corn Syrup, Salt, Caramel Color, Sugar, Spices, Anchovy (Fish), Natural Flavor (Soy), Tamarind Extract And Soy Lecithin), Tomato Paste 6 x #10 (Tomato Paste, Citric Acid.), Coarse Kosher Salt (Salt, Yellow Prussiate Of Soda), Butter Solids (Pasteurized Cream, Salt), Canola Oil (Canola Oil With TBHQ And Citric Acid Added To Help Protect Flavor. Dimethylpolysiloxane, An Antifoaming Agent, Added.), Garlic Chopped (Minced Garlic (Peeled Garlic)), Celery, Base Vegetable Mirepoix Sauteed 6 x 1# (Sauteed Vegetable Puree Mix (Carrots, Onions, Celery), Salt, Sugar, Maltodextrin, Corn Oil, Less Than 2% Of Yeast Extract, Water, Potato Starch, Xanthan Gum, Natural Flavors, Carrot Juice Concentrate.), Spice Thyme Leaf (Thyme Leaves), Spice Pepper Black Ground 18 oz (Black Pepper)","['Fish', 'Milk', 'Soy']"
